title,intro,prep_time,cook_time,total_time,servings,ingredients,directions,nutrition,recipe_url
"Cheesy Bacon, Sausage, and Egg Hash Brown Skillet","This cheesy hash brown skillet with bacon, sausage, and egg is a scrumptious, easy breakfast. Garnish with 2 thinly sliced green onions, if desired.",10 mins,30 mins,40 mins,6,"['6 slices bacon, cut into 1-inch pieces', '1 link smoked pineapple-bacon chicken sausage, cut into slices', '1 tablespoon canola oil', '1 teaspoon butter', '2 ½ cups frozen hash brown potatoes, thawed', '½  onion, chopped', '¾ teaspoon garlic powder, divided', '½ teaspoon onion powder', '¼ teaspoon salt, or more to taste', '¼ teaspoon ground black pepper, or more to taste', '1 cup shredded Cheddar cheese', '6 large eggs', '1 tablespoon milk']","['Preheat the oven to 350 degrees F (175 degrees C).', 'Place bacon in a 10-inch skillet and cook over medium heat, stirring occasionally, until crisp, about 10 minutes. Use a slotted spoon to remove bacon to a paper towel-lined small bowl. Discard 1/2 of the bacon fat using a spoon.', 'Cook sausage in remaining bacon fat in the hot skillet until browned on both sides, about 5 minutes. Remove to the bowl with bacon.', 'Heat canola oil and butter in the same skillet over medium heat. Add hash browns and onion. Stir in 1/2 teaspoon garlic powder, onion powder, salt, and black pepper. Spread hash brown mixture evenly in the skillet; cook, undisturbed, until browned, about 5 minutes. Turn hash browns over and sprinkle with Cheddar cheese.', 'Whisk together eggs, milk, and remaining 1/4 teaspoon garlic powder in a medium bowl; season with salt and pepper. Pour egg mixture over cheese-covered hash browns in the skillet. Sprinkle the top with bacon and sausage pieces.', 'Bake in the preheated oven until the top is puffed, cheese is melted, and a knife inserted into the center comes out clean, 10 to 15 minutes.']","{'Calories': '312', 'Fat': '24g', 'Carbs': '15g', 'Protein': '18g'}",https://www.allrecipes.com/recipe/261541/cheesy-bacon-sausage-egg-hash-brown-skillet/
Homemade Beef Breakfast Sausage Patties,This easy recipe for beef breakfast sausage is a delicious alternative to pork!,5 mins,10 mins,1 day 15 mins,8,"['2 pounds ground beef (75% to 80% lean)', '1 tablespoon brown sugar', '2 teaspoons dried sage', '2 teaspoons salt', '2 teaspoons dried basil', '1 teaspoon ground black pepper', '1 teaspoon onion powder', '¼ teaspoon dried marjoram', '⅛ teaspoon crushed red pepper flakes']","['Gather the ingredients.\n\n \n\n\n\n\n\n \n Dotdash Meredith Food Studios', 'Place ground beef into a large bowl.\n\n \n\n\n\n\n\n \n Dotdash Meredith Food Studios', 'Stir brown sugar, sage, salt, basil, black pepper, onion powder, marjoram, and red pepper flakes together in a small bowl.\n\n \n\n\n\n\n\n \n Dotdash Meredith Food Studios', 'Sprinkle over beef and use your hands to mix until evenly distributed. Cover and refrigerate until flavors have blended, about 24 hours.\n\n \n\n\n\n\n\n \n Dotdash Meredith Food Studios', 'Divide beef mixture into 8 patties.\n\n \n\n\n\n\n\n \n Dotdash Meredith Food Studios', 'Heat a large nonstick skillet over medium heat. Working in batches, cook patties in the hot skillet until firm and no longer pink in the center, 5 to 7 minutes per side. An instant-read thermometer inserted into the center should read at least 160 degrees F (70 degrees C).\n\n \n\n\n\n\n\n \n Dotdash Meredith Food Studios']","{'Calories': '215', 'Fat': '14g', 'Carbs': '2g', 'Protein': '19g'}",https://www.allrecipes.com/recipe/205747/homemade-beef-breakfast-sausage-patties/
Homemade Lox,"This homemade lox recipe takes some time to prepare, but the investment is well worth it. I prefer my lox without the smoky flavor. Try it once, and see if you agree.",20 mins,,2 days 50 mins,8,"['1 pound salmon fillet, bones removed', '½ cup kosher salt', '½ cup white sugar', '9 drops liquid smoke flavoring (Optional)']","['Rinse salmon with water; pat dry with paper towels.', 'Lay a piece of plastic wrap onto a flat surface. Mix together kosher salt and sugar in a small bowl. Pour 1/2 of the salt mixture onto the plastic wrap; lay salmon on top. Cover salmon with remaining salt mixture.', ""Fold plastic wrap around salmon until secure; cover with a second layer of plastic wrap. Transfer to a 9x9-inch baking pan; cover with an 8x8-inch baking pan. Place a heavy object onto the smaller baking pan to weigh salmon down. Cure in the refrigerator until salmon's surface is silky, about 48 hours."", 'Fill a large bowl with ice water. Fill a second bowl with cold water and 3 drops liquid smoke.', 'Unwrap salmon and dip in liquid smoke mixture to rinse. Remove to ice water and let sit, submerged, for 30 minutes. Repeat rinsing and submerging 2 more times, adding 3 drops liquid smoke to ice water each time.', 'Dry salmon with paper towels. Slice with a sharp knife, starting at the thin edge.']","{'Calories': '120', 'Fat': '3g', 'Carbs': '13g', 'Protein': '10g'}",https://www.allrecipes.com/recipe/254896/homemade-lox/
"Spinach, Sausage, and Egg Casserole",This spinach egg casserole without bread is always a big hit. I created it after my boyfriend described an egg casserole I couldn't find a recipe for. Everyone loves it!,15 mins,35 mins,50 mins,12,"['1 pound breakfast sausage', '11 large eggs', '¾ cup milk', '2 cups shredded sharp Cheddar cheese', '1 (10 ounce) package frozen chopped spinach, thawed and drained', '1 teaspoon dried oregano']","['Gather all ingredients and preheat the oven to 350 degrees F (175 degrees C). Grease a 9x13-inch baking dish.\n\n \n\n\n\n\n\n \n Dotdash Meredith Food Studios', 'Heat a large skillet over medium-high heat. Cook and stir sausage in the hot skillet until browned and crumbly, 5 to 7 minutes; drain and discard grease.\n\n \n\n\n\n\n\n \n Dotdash Meredith Food Studios', 'Beat together eggs and milk in a large bowl.\n\n \n\n\n\n\n\n \n Dotdash Meredith Food Studios', 'Stir in cooked sausage, Cheddar cheese, spinach, and oregano until well combined; pour into the prepared baking dish.\n\n \n\n\n\n\n\n \n Dotdash Meredith Food Studios', 'Bake in the preheated oven until a knife inserted into the center of casserole comes out clean, 30 to 40 minutes.\n\n \n\n\n\n\n\n \n Dotdash Meredith Food Studios']","{'Calories': '238', 'Fat': '17g', 'Carbs': '3g', 'Protein': '19g'}",https://www.allrecipes.com/recipe/241924/spinach-sausage-and-egg-casserole/
Joseph's Best Easy Bacon Recipe,"Preparing this bacon is literally the first thing I do after I wake up on weekend mornings. I put the bacon in the cold oven, set it to 425 F, brush my teeth, start cooking other breakfast items, and then take the bacon out after 14 minutes — that's it! My theory is that by placing the bacon in a cold oven to start, as the oven gradually heats, the bacon undergoes a magical transformation from a cold, flabby piece of meat to crispy bacon heaven as the oven hits the 425-degree mark.",5 mins,15 mins,25 mins,6,['1 (16 ounce) package thick-cut bacon'],"['Line a large baking sheet with 2 sheets aluminum foil, making sure the sheet is completely covered.', 'Arrange bacon strips 1/2-inch apart on the prepared baking sheet. Place in the cold oven.', 'Heat the oven to 425 degrees F (220 degrees C). Cook bacon for 14 minutes.', 'Transfer cooked bacon to a paper towel-lined plate. Let cool for 5 minutes for bacon to crisp.']","{'Calories': '134', 'Fat': '10g', 'Carbs': '0g', 'Protein': '9g'}",https://www.allrecipes.com/recipe/232675/josephs-best-easy-bacon-recipe/
Overnight Christmas Breakfast Casserole,"I certainly cannot take credit for this Christmas breakfast casserole recipe as it's a classic. Some know it as wife saver, others would call it a strata. Make this tasty breakfast dish the night before and just pop it in the oven on Christmas morning; let it cook while you open gifts and sip your rum-spiked coffee!",20 mins,1 hr,9 hrs 20 mins,8,"['16 slices bread, crusts removed - divided', '16 slices Canadian bacon', '16 slices sharp Cheddar cheese', '6 large eggs', '½ teaspoon salt', '½ teaspoon ground black pepper', '1 teaspoon dry mustard', '¼ cup minced onion', '2 tablespoons diced green bell pepper', '2 tablespoons diced red bell pepper', '2 teaspoons Worcestershire sauce', '1 dash hot sauce', '3 cups whole milk', '½ cup butter, melted', '1 cup crushed corn flakes cereal']","['Butter a 9x13-inch baking dish. Cut and fit 8 slices of bread to fit over entire bottom of dish. Cover bread with slices of Canadian bacon and sharp Cheddar cheese. Cut and fit remaining 8 slices of bread to completely cover bacon and cheese.', 'Whisk eggs with salt and black pepper in a bowl. Whisk dry mustard, onion, diced green and red bell pepper, Worcestershire sauce, and hot sauce into eggs. Whisk in milk until egg mixture is smoothly combined. Pour egg mixture evenly over the casserole. Cover the dish and refrigerate overnight.', 'Preheat oven to 350 degrees F (175 degrees C).', 'Pour melted butter evenly over the casserole and sprinkle corn flake crumbs over the top.', 'Bake in the preheated oven until set and lightly browned, about 1 hour. Let casserole stand for 10 minutes before serving.']","{'Calories': '647', 'Fat': '41g', 'Carbs': '35g', 'Protein': '34g'}",https://www.allrecipes.com/recipe/230444/christmas-morning-wife-saver-breakfast-casserole/
Chef John's Quiche Lorraine,"In my opinion, a proper quiche recipe results in a rich, custardy, and luxurious quiche, not some kind of dense, baked omelet. This recipe has only enough eggs and yolks to hold things together, but that means that before serving, you need to let it cool to just warm to fully enjoy the experience.",30 mins,1 hr 5 mins,1 hr 55 mins,8,"['dough for a (9-inch) deep-dish pie crust', '8 slices bacon, cut into 1-inch pieces', '½ cup chopped leeks (white and pale green parts only)', '½ cup chopped onion', 'salt and freshly ground black pepper to taste', '1 pinch cayenne pepper, or more to taste', '3 large eggs', '2  egg yolks', '1 cup heavy cream', '¾ cup milk', '1 teaspoon chopped fresh thyme', '6 ounces shredded Gruyère cheese']","['Roll pie dough to fit a (9-inch) deep-dish pie plate. Press into the pie plate and chill in the refrigerator for at least 20 minutes before baking.', 'Preheat the oven to 425 degrees F (220 degrees C).', 'Line chilled pie crust with foil and fill halfway with dried beans, rice, or baking weights. Bake in the preheated oven for 7 minutes. Remove the foil and weights and continue to bake until golden brown, about 5 minutes.', 'While the pie crust is baking, cook bacon in a skillet over medium heat until browned and cooked through, 8 to 10 minutes. Remove from the pan to drain. Blot out some of the oil from the skillet, leaving 1 to 2 teaspoons. Add leeks, onion, salt, pepper, and cayenne pepper; cook and stir until tender and golden brown, 5 to 7 minutes. Set aside.', 'Remove the pie crust from the oven. Reduce the oven temperature to 325 degrees F (165 degrees C).', 'Whisk eggs and egg yolks together with cream and milk in a large bowl. Add thyme and stir to combine.', 'Sprinkle 2/3 of the leek mixture over the bottom of the baked crust. Top with 1/3 of the cooked bacon and 2/3 of the Gruyère. Carefully ladle in egg mixture, then sprinkle with remaining leek mixture, bacon, and Gruyère.', 'Bake in the preheated oven until browned, set, and no longer jiggly in the center, 40 to 45 minutes. Allow to cool slightly before serving.']","{'Calories': '413', 'Fat': '33g', 'Carbs': '14g', 'Protein': '16g'}",https://www.allrecipes.com/recipe/223196/chef-johns-quiche-lorraine/
Spinach Quiche with Chicken,"This chicken quiche recipe works very well. Add seasonings of your family's choice for more variety. Use ham, bacon, or whatever protein. This quiche needs flavor boosters, so use your spice cabinet. Easily make this a Tex-Mex dish with diced green chiles and a touch of cumin. You could also add crumbled, freshly cooked bacon for more flavor. I served this with sliced avocado and tomatoes for a perfect light dinner.",20 mins,35 mins,1 hr 10 mins,8,"['1 cup shredded Cheddar cheese', '1 (9 inch) unbaked pastry shell', '1 cup diced cooked chicken', '1 cup chopped fresh spinach', '½ cup chopped sweet onion (such as Vidalia®)', '3 large eggs', '¾ cup half-and-half', '½ cup mayonnaise', '¼ teaspoon salt', '⅛ teaspoon ground black pepper', '1 pinch salt-free seasoning blend (such as Mrs. Dash), or to taste', '1 pinch herbes de Provence, or to taste']","['Preheat the oven to 350 degrees F (175 degrees C).', 'Sprinkle 1/4 cup Cheddar cheese into pastry shell. Mix together chicken, spinach, remaining 3/4 cup Cheddar cheese, and onion in a medium bowl; transfer mixture to pastry shell.', 'Whisk together eggs, half-and-half, mayonnaise, salt, black pepper, seasoning blend, and herbes de Provence in a second medium bowl until well combined; pour over chicken mixture.', 'Bake in the preheated oven until a knife inserted into the center comes out clean, 35 to 40 minutes. Let stand for 15 minutes before slicing and serving.']","{'Calories': '352', 'Fat': '28g', 'Carbs': '13g', 'Protein': '12g'}",https://www.allrecipes.com/recipe/228592/spinach-quiche-with-chicken/
Sausage Hashbrown Breakfast Casserole,"This breakfast casserole recipe is made with hash browns, sausage, eggs, and cheese — what's not to love? It can be made ahead of time and refrigerated until you're ready to bake it. It's great for a work potluck, an overnight guest, or an easy breakfast on Christmas morning!",20 mins,50 mins,1 hr 10 mins,10,"['cooking spray', '2 pounds bulk spicy breakfast sausage', '2 pounds frozen hash brown potatoes', '2 cups shredded Cheddar cheese', '1 (7 ounce) can green chile peppers (Optional)', '8 large eggs', '2 cups milk', '1 teaspoon salt', '½ teaspoon ground black pepper', '½ teaspoon onion powder', '½ teaspoon garlic powder']","['Preheat the oven to 350 degrees F (175 degrees C). Spray a 9x13-inch baking dish with cooking spray.', 'Cook and stir sausage in a hot skillet over medium heat until crumbly and no longer pink, 5 to 7 minutes. Drain and discard grease, and transfer sausage to a bowl.', 'Cook hash browns in the skillet in the residual grease over medium heat, stirring occasionally, until lightly browned, about 8 minutes. Remove from the heat.', 'Transfer hash browns to the prepared baking dish and spread in an even layer across the bottom. Sprinkle cooked sausage over top, then layer with Cheddar cheese and chile peppers.', 'Whisk milk, eggs, salt, pepper, onion powder, and garlic powder together in a bowl. Pour over hash brown mixture.', 'Bake casserole, uncovered, in the preheated oven until bubbly and the top is golden brown, 35 to 40 minutes.']","{'Calories': '481', 'Fat': '38g', 'Carbs': '21g', 'Protein': '27g'}",https://www.allrecipes.com/recipe/260163/sausage-hashbrown-breakfast-casserole/
Christmas Morning Egg Casserole,This was the casserole my mom made every year for Christmas morning.,20 mins,1 hr,9 hrs 20 mins,8,"['cooking spray (such as Pam®)', '2 cups diced cooked ham', '2 tablespoons butter, or as needed', '7 slices bread, crusts removed', '½ pound American cheese, cubed', '3 cups milk', '6  eggs, beaten', '¾ teaspoon dry mustard', '¾ teaspoon salt']","['Gather all ingredients.\n\n \n\n\n\n\n\n \n Dotdash Meredith Food Studios', 'Spray a 9x13-inch casserole dish with cooking spray.', 'Spread ham into the bottom of prepared casserole dish. Butter one side of each bread slice; cut slices into cubes. Arrange buttered bread cubes atop ham; layer American cheese over bread cubes.\n\n \n\n\n\n\n\n \n Dotdash Meredith Food Studios', 'Whisk milk, eggs, mustard powder, and salt together in a bowl; pour over American cheese layer. Cover dish with aluminum foil and refrigerate 8 hours or overnight.\n\n \n\n\n\n\n\n \n Dotdash Meredith Food Studios\n\n \n\n\n\n\n\n \n Dotdash Meredith Food Studios', 'Preheat oven to 350 degrees F (175 degrees C). Remove aluminum foil from casserole.\n\n \n\n\n\n\n\n \n Dotdash Meredith Food Studios', 'Bake in the preheated oven until cheese is melted and eggs are set in the middle, about 1 hour.\n\n \n\n\n\n\n\n \n Dotdash Meredith Food Studios']","{'Calories': '374', 'Fat': '24g', 'Carbs': '16g', 'Protein': '22g'}",https://www.allrecipes.com/recipe/229517/christmas-morning-egg-casserole/
Sharon's Egg and Ham Scramble,"This is my original ham and egg scramble recipe, although there might be a zillion egg recipes very similar to it. The number of servings depends upon your appetite and what else is on the table to go with it.",10 mins,10 mins,20 mins,4,"['8  eggs, beaten', '3 tablespoons milk, or more to taste', '¼ teaspoon seasoned salt (such as Season-All)', 'salt and ground black pepper to taste', '1 tablespoon olive oil, or more as needed', '1 jalapeño pepper, seeded and minced', '½ cup chopped applewood-smoked ham deli slices', '1 cup finely shredded Cheddar cheese, divided']","['Whisk eggs, milk, seasoned salt, salt, and black pepper together in a bowl.', 'Heat oil in a large nonstick skillet over medium-high heat. Add jalapeño and sauté until slightly softened, 2 to 3 minutes. Add ham and cook until heated through, about 1 minute.', 'Pour egg mixture into the skillet. Cook and stir until eggs are set but not dry, 3 to 5 minutes. Sprinkle 1/2 of the Cheddar over eggs; cook and stir until cheese is melted. Transfer eggs to a plate and sprinkle remaining Cheddar over the top.']","{'Calories': '316', 'Fat': '23g', 'Carbs': '4g', 'Protein': '22g'}",https://www.allrecipes.com/recipe/240125/sharons-egg-and-ham-scramble/
Egg and Sausage Casserole,"This egg and sausage casserole is easy to make and always a hit. The recipe was given to me by a friend several years ago. Co-workers beg for it, and it's my husband's favorite!",15 mins,35 mins,50 mins,12,"['1 pound pork sausage', '8  eggs, beaten', '2 cups shredded mozzarella cheese', '2 cups shredded Cheddar cheese', '1 teaspoon dried oregano', '1 (8 ounce) package refrigerated crescent roll dough']","['Preheat the oven to 325 degrees F (165 degrees C). Lightly grease a 9x13-inch baking dish.', 'Cook sausage in a large, deep skillet over medium-high heat, until evenly browned, 7 to 9 minutes. Drain and crumble into small pieces.', 'Mix beaten eggs, mozzarella, Cheddar, and oregano together in a large bowl.', 'Line the bottom of the prepared baking dish with crescent roll dough, then sprinkle crumbled sausage over top. Pour egg mixture over sausage.', 'Bake in the preheated oven until a knife inserted into the center comes out clean, 25 to 30 minutes.']","{'Calories': '341', 'Fat': '25g', 'Carbs': '9g', 'Protein': '20g'}",https://www.allrecipes.com/recipe/20916/egg-and-sausage-casserole/
Sausage Hash Brown Breakfast Casserole,This sausage and hash brown breakfast casserole with a make-ahead option is super easy and actually good. It's also great if you add a little onion.,5 mins,55 mins,1 hr,4,"['1 pound hot pork sausage', '1 cup milk', '3  large eggs, beaten', '1 ½ teaspoons salt, divided', '1/2 (30 ounce) package frozen hash brown potatoes, thawed', '1 cup shredded Cheddar cheese', '1/2 teaspoon ground black pepper']","['Gather all ingredients. Preheat the oven to 350 degrees F (175 degrees C). Grease a 9-inch square baking dish or a 9-inch, deep-dish pie plate.\n\n \n\n\n\n\n\n \n Carson Downing', 'Cook sausage in a large skillet over medium-high heat until browned and crumbly, 5 to 7 minutes. Drain and discard grease.\n\n \n\n\n\n\n\n \n Carson Downing', 'Whisk milk, eggs, and 1 teaspoon salt together in a bowl.\n\n \n\n\n\n\n\n \n Carson Downing', 'Transfer cooked sausage to a large bowl. Add hash browns, Cheddar, pepper, and remaining 1/2 teaspoon salt; stir well to combine.\n\n \n\n\n\n\n\n \n Carson Downing', 'Spread in an even layer in the prepared baking dish, then pour egg mixture evenly over top.\n\n \n\n\n\n\n\n \n Carson Downing', 'Bake in the preheated oven until bubbling and golden, about 45 minutes.\n\n \n\n\n\n\n\n \n Carson Downing', 'Enjoy!\n\n \n\n\n\n\n\n \n Carson Downing']","{'Calories': '573', 'Fat': '45g', 'Carbs': '23g', 'Protein': '31g'}",https://www.allrecipes.com/recipe/241105/sausage-hash-brown-breakfast-casserole/
