title,intro,prep_time,cook_time,total_time,servings,ingredients,directions,nutrition,recipe_url
Southern Grits Casserole,"You'll love this grits casserole with ground sausage and cheese, especially if you're from the South. When I cook it, I place it in the slow cooker to stay warm. There is nothing worse than cold grits for breakfast!",15 mins,50 mins,1 hr 5 mins,16,"['6 cups water', '2 cups uncooked grits', '3 cups shredded Cheddar cheese, divided', '½ cup butter, cut into pieces, divided', '1 pound ground pork sausage', '12 large eggs', '½ cup milk', 'salt and pepper to taste']","['Preheat the oven to 350 degrees F (175 degrees C). Lightly grease a large baking dish.', 'Bring water to a boil in a large saucepan; stir in grits. Reduce the heat, cover, and simmer until liquid has been absorbed, about 5 minutes. Mix in 2 cups Cheddar cheese and 1/2 of the butter until melted.', 'Cook sausage in a skillet over medium-high heat until browned and crumbly, 5 to 7 minutes. Drain and add to grits mixture.', 'Whisk eggs and milk together in a bowl. Pour into the skillet used to cook the sausage. Lightly scramble eggs over medium-low heat, then mix into grits mixture.', 'Pour grits mixture into the prepared baking dish. Dot with remaining butter, sprinkle with remaining 1 cup Cheddar, and season with salt and pepper.', 'Bake in the preheated oven until lightly browned, about 30 minutes.\n\n \n\n\n\n\n\n \n Melissa Goff']","{'Calories': '403', 'Fat': '30g', 'Carbs': '17g', 'Protein': '17g'}",https://www.allrecipes.com/recipe/46968/southern-grits-casserole/
Sausage and Egg Casserole,"This sausage and egg casserole recipe is the perfect combination of eggs, sausage, bread, and cheese. It's tender and delicious, and the family likes it!",15 mins,50 mins,9 hrs 35 mins,8,"['1 pound bulk pork sausage', '8 large eggs', '2 ½ cups milk', '1 teaspoon salt', '1 teaspoon ground mustard', '6 slices white bread, cut into 1/2-inch cubes', '1 cup shredded Cheddar cheese', 'cooking spray']","['Gather all ingredients.\n\n \n\n\n\n\n\n \n Dotdash Meredith Food Studios', 'Heat a large skillet over medium-high heat and stir in sausage. Cook and stir until sausage is crumbly, evenly browned, and no longer pink, about 10 minutes. Drain and discard any excess grease.\n\n \n\n\n\n\n\n \n Dotdash Meredith Food Studios', 'Beat eggs in a large bowl; stir in milk, salt, and mustard.\n\n \n\n\n\n\n\n \n Dotdash Meredith Food Studios', 'Fold bread cubes, Cheddar cheese, and sausage into the egg mixture.\n\n \n\n\n\n\n\n \n Dotdash Meredith Food Studios', 'Pour into a lightly greased 7x11-inch baking dish. Cover and refrigerate, 8 hours to overnight.\n\n \n\n\n\n\n\n \n Dotdash Meredith Food Studios', 'Preheat the oven to 350 degrees F (175 degrees C). Remove casserole from the refrigerator 30 minutes before baking.', 'Bake in the preheated oven until a knife inserted near the center comes out clean, about 40 minutes.\n\n \n\n\n\n\n\n \n Dotdash Meredith Food Studios']","{'Calories': '363', 'Fat': '24g', 'Carbs': '14g', 'Protein': '22g'}",https://www.allrecipes.com/recipe/222595/sausage-and-egg-casserole/
Dairy-Free Savory Sausage Gravy,"This dairy-free sausage gravy is a fairly basic, large-batch gravy recipe that I've developed over time. The family loves it every time, so the large batch is needed! Normally I'd use soy milk for most things, but I've found that in greater quantities it tends to froth badly. Almond milk does not have this problem though. Serve over warmed biscuits or the toasted bread of your choice.",5 mins,20 mins,25 mins,20,"['2 pounds breakfast sausage', '2 ½ tablespoons Worcestershire sauce', '1 cube beef bouillon, crushed (Optional)', '1 teaspoon ground nutmeg', '1 cup all-purpose flour', '4 cups almond milk, or as needed', '3 teaspoons ground black pepper, or to taste', '1 teaspoon salt']","['Break sausage apart in a large skillet over medium-high heat. Cook until starting to brown, 3 to 5 minutes. Add Worcestershire sauce and let it heat up before adding beef bouillon and nutmeg. Stir and cook sausage until no longer pink, 3 to 5 minutes more.', 'Reduce heat to medium-low and sprinkle in flour gradually. Cook, stirring constantly, until flour coats sausage and is completely absorbed. Cook for 1 to 2 minutes more.', 'Pour in almond milk gradually, stirring constantly until gravy starts to thicken, up to 12 minutes. Add a little more almond milk if too thick. Season with pepper and salt. Continue stirring vigorously until gravy reaches desired thickness.', 'Remove from heat and let cool. Taste and adjust seasoning as desired.']","{'Calories': '155', 'Fat': '10g', 'Carbs': '8g', 'Protein': '7g'}",https://www.allrecipes.com/recipe/269196/dairy-free-savory-sausage-gravy/
Easy Quiche Lorraine,"This quiche recipe with milk, eggs, bacon, and Swiss cheese is a delicious way to start a meal.",20 mins,1 hr,1 hr 30 mins,6,"['1  unbaked 9 inch pie crust', '6 slices bacon', '1  onion, chopped', '1 ½ cups milk', '3 large eggs, beaten', '¼ teaspoon salt', '1 ½ cups shredded Swiss cheese', '1 tablespoon all-purpose flour']","['Preheat the oven to 450 degrees F (230 degrees C).', 'Line pie crust with a double layer of aluminum foil. Bake in the preheated oven for 8 minutes. Remove foil and continue baking until crust is just set, 4 to 5 minutes. Reduce oven temperature to 325 degrees F (165 degrees C).', 'Place bacon in a large skillet and cook over medium-high heat, turning occasionally, until evenly browned, about 10 minutes. Drain bacon slices on paper towels, crumble, and set aside. Reserve 2 tablespoons bacon grease in the skillet.', 'Cook and stir onion in reserved grease in the skillet over medium heat until tender; drain and set aside.', 'Mix together milk, eggs, and salt in a large bowl. Stir in bacon and onion. Toss together Swiss cheese and flour in a medium bowl; add to egg mixture and stir well. Pour into par-baked crust.', 'Bake in the preheated oven until a knife inserted into the center comes out clean, 35 to 40 minutes. Cover edges of crust with foil if they begin to get too brown. Let quiche cool for 10 minutes before serving.']","{'Calories': '461', 'Fat': '34g', 'Carbs': '21g', 'Protein': '18g'}",https://www.allrecipes.com/recipe/21544/easy-quiche-lorraine/
Oeufs Cocotte (Baked Eggs),"Oeufs cocotte are French baked eggs cooked in cream with ham and cheese. You can make them in individual ramekins or a casserole dish, then bake in a water bath in the oven. Simply delicious served hot with toast or strips of bread to dip in the runny egg yolks.",10 mins,15 mins,25 mins,2,"['1 tablespoon olive oil, or to taste', '½ cup finely chopped ham', '2 tablespoons grated Gruyère cheese', '½ cup heavy whipping cream', 'salt and ground black pepper to taste', '2 large eggs', '¼ teaspoon chopped fresh chives']","['Preheat the oven to 375 degrees F (190 degrees C). Grease a small, lidded casserole dish with olive oil. Boil water in a kettle and set aside.', 'Arrange ham in the bottom of the prepared casserole dish. Sprinkle with 1 tablespoon Gruyère cheese. Pour in cream and season with black pepper. Crack eggs on top, one at a time, making sure yolks remain intact. Sprinkle with remaining 1 tablespoon Gruyère cheese and chives. Season with salt and black pepper.', 'Cover the casserole dish and place it into a roasting pan. Pour enough boiled water into the roasting pan so it reaches about halfway up the sides of the casserole dish.', 'Bake in the preheated oven for 9 minutes. Uncover and continue baking until whites are just set and yolks are still runny, 3 to 6 more minutes.']","{'Calories': '447', 'Fat': '42g', 'Carbs': '2g', 'Protein': '16g'}",https://www.allrecipes.com/recipe/262798/oeufs-cocotte-baked-eggs/
Eggs Benedict Casserole,"This overnight eggs Benedict casserole is easy to make ahead for brunch, a special occasion, or even for house guests.",25 mins,45 mins,9 hrs 10 mins,10,"['cooking spray', '2 cups milk', '8 large eggs', '3 stalks green onions, chopped', '1 teaspoon onion powder', '1 teaspoon salt', '¾ pound Canadian bacon, cut into ½-inch dice', '6 English muffins, cut into ½-inch dice', '½ teaspoon ground paprika', '1 cup milk', '1 (0.9 ounce) package Hollandaise sauce mix', '¼ cup butter']","['Gather the ingredients. Grease a 9x13-inch baking dish with cooking spray.\n\n \n\n\n\n\n\n \n Allrecipes / Qi Ai', 'To prepare the casserole: Whisk milk, eggs, green onions, onion powder, and salt together in a large bowl until well combined. Set aside.\n\n \n\n\n\n\n\n \n Allrecipes / Qi Ai', 'Layer 1/2 of the Canadian bacon in the prepared baking dish; cover with English muffins.\n\n \n\n\n\n\n\n \n Allrecipes / Qi Ai', 'Top with remaining Canadian bacon and pour egg mixture over everything. Cover the baking dish with plastic wrap and refrigerate, 8 hours to overnight.\n\n \n\n\n\n\n\n \n Allrecipes / Qi Ai', 'Preheat the oven to 375 degrees F (190 degrees C). Remove plastic wrap and sprinkle casserole with paprika; cover the baking dish with aluminum foil.\n\n \n\n\n\n\n\n \n Allrecipes / Qi Ai', 'Bake in the preheated oven until eggs are nearly set, about 30 minutes. Remove the foil and continue baking until eggs are completely set, about 15 minutes more.\n\n \n\n\n\n\n\n \n Allrecipes / Qi Ai', 'Meanwhile, make the sauce: Whisk 1 cup milk and Hollandaise sauce mix in a saucepan over medium heat. Add butter; cook, stirring frequently, until boiling. Reduce heat to medium-low and simmer, stirring constantly, until thickened, about 1 minute.\n\n \n\n\n\n\n\n \n Allrecipes / Qi Ai', 'To serve: Slice casserole into 10 pieces; transfer each piece onto a plate and drizzle warm sauce on top.\n\n \n\n\n\n\n\n \n Allrecipes / Qi Ai', 'Enjoy!\n\n \n\n\n\n\n\n \n Allrecipes / Qi Ai']","{'Calories': '281', 'Fat': '14g', 'Carbs': '21g', 'Protein': '18g'}",https://www.allrecipes.com/recipe/221988/eggs-benedict-casserole/
Dry-Brined Smoked Salmon,A perfect dry-brined smoked salmon recipe. We've been playing with smoked salmon recipes for years and this quick dry-brine process is easy and delicious. A go-to appetizer in our house any time there's a party. Try serving it with plain bagels and cream cheese.,15 mins,2 hrs,10 hrs 30 mins,12,"['1 ½ cups brown sugar, divided', '1 cup kosher salt', '3 pounds salmon fillets', '½ cup honey', '2 (12 fluid ounce) cans or bottles cola-flavored carbonated beverage (such as Coca-Cola®) (Optional)', '3 cups wood chips, soaked']","['Mix 1 cup brown sugar and kosher salt together in a small bowl.', 'Spread a thin layer of the brown sugar mixture in the bottom of a 9-inch baking pan. Arrange 2 to 3 salmon fillets on top; cover with some of the brown sugar mixture. Repeat layers until all the salmon fillets are coated. Cover with plastic wrap and refrigerate, 8 hours to overnight.', ""Preheat a smoker to 195 degrees F (91 degrees C) according to manufacturer's instructions."", 'Rinse brown sugar mixture off salmon fillets. Brush fillets lightly with honey and sprinkle remaining 1/2 cup brown sugar on top.', ""Pour cola-flavored beverage into the smoker's water pan; add water to within 1 inch of the top. Place half of the wood chips around the perimeter of the hot charcoal. Place salmon on the cooking racks."", 'Cook salmon, adding more wood chips if needed, until an instant-read thermometer inserted into the center reads 145 degrees F (63 degrees C), about 2 hours. Cool before serving, at least 15 minutes.']","{'Calories': '296', 'Fat': '4g', 'Carbs': '45g', 'Protein': '21g'}",https://www.allrecipes.com/recipe/255943/dry-brined-smoked-salmon/
Christmas Brunch Casserole,"This Christmas breakfast casserole with hash browns, mushrooms, bacon, and eggs is easy to prepare on Christmas Eve. Just pop it in the oven for an hour on Christmas morning, and enjoy it for breakfast or brunch.",20 mins,1 hr 15 mins,9 hrs 35 mins,8,"['1 pound bacon', '2 medium onions, chopped', '2 cups fresh sliced mushrooms', '1 tablespoon butter', '4 cups frozen hash brown potatoes, thawed', '1 teaspoon salt', '½ teaspoon ground black pepper', '¼ teaspoon garlic salt', '4 medium eggs', '1 ½ cups milk', '1 pinch dried parsley', '1 cup shredded Cheddar cheese']","['Gather all ingredients.\n\n \n\n\n\n\n\n \n Allrecipes/Karen Hibbard', 'Cook bacon in a large skillet over medium-high heat, turning occasionally, until evenly browned, about 10 minutes. Transfer bacon to a paper towel-lined plate and crumble when cool enough to handle. Drain grease from the skillet.\n\n \n\n\n\n\n\n \n Allrecipes/Karen Hibbard', 'Cook onions and mushrooms in the residual grease in the skillet until onions are translucent and mushrooms are tender, about 5 minutes.\n\n \n\n\n\n\n\n \n Allrecipes/Karen Hibbard', 'Grease a 9x13-inch casserole dish with 1 tablespoon of butter. Place potatoes into the bottom of the dish; sprinkle with salt, pepper, and garlic salt. Top with crumbled bacon, then add onions and mushrooms.\n\n \n\n\n\n\n\n \n Allrecipes/Karen Hibbard', 'Whisk milk, eggs, and parsley together in a mixing bowl; pour over casserole and top with Cheddar. Cover and refrigerate, 8 hours to overnight.\n\n \n\n\n\n\n\n \n Allrecipes/Karen Hibbard\n\n \n\n\n\n\n\n \n Allrecipes/Karen Hibbard', 'When ready to bake, preheat the oven to 400 degrees F (200 degrees C). Bake in the preheated oven until set, about 1 hour.\n\n \n\n\n\n\n\n \n Allrecipes/Karen Hibbard', 'Serve hot and enjoy!\n\n \n\n\n\n\n\n \n Allrecipes/Karen Hibbard']","{'Calories': '421', 'Fat': '33g', 'Carbs': '17g', 'Protein': '14g'}",https://www.allrecipes.com/recipe/15047/christmas-brunch-casserole/
Easy Breakfast Egg Muffins,These breakfast egg muffins are inspired by your favorite morning casserole or omelet! Great for an on-the-go breakfast and very customizable to your tastes. You can substitute any vegetables or meat that you like. I love to make a dozen of these and have them in my fridge to grab in the morning on my way to work.,15 mins,30 mins,45 mins,12,"['cooking spray', '1  green bell pepper, chopped', '1  red bell pepper, chopped', '1 bunch green onions, chopped', '8 large eggs', '2 ¾ ounces fully-cooked bacon pieces (such as Oscar Mayer®)', '¼ cup whole milk', '1 pinch garlic powder, or to taste', '1 pinch onion powder, or to taste', 'salt and ground black pepper to taste', '½ (8 ounce) package shredded mild Cheddar cheese']","['Gather all ingredients. Preheat the oven to 350 degrees F (175 degrees C). Grease a 12-cup muffin tin with cooking spray.\n\n \n\n\n\n\n\n \n Grant Webster / Food Stylist: Holly Dreesman / Prop Stylist: Gabe Greco', 'Place bell peppers and green onions into a large bowl.\n\n \n\n\n\n\n\n \n Grant Webster / Food Stylist: Holly Dreesman / Prop Stylist: Gabe Greco', 'Add eggs, bacon, milk, garlic powder, onion powder, salt, and pepper.\n\n \n\n\n\n\n\n \n Grant Webster / Food Stylist: Holly Dreesman / Prop Stylist: Gabe Greco', 'Sprinkle Cheddar cheese into the bowl and whisk until incorporated.\n\n \n\n\n\n\n\n \n Grant Webster / Food Stylist: Holly Dreesman / Prop Stylist: Gabe Greco', 'Pour mixture equally into the prepared muffin cups.\n\n \n\n\n\n\n\n \n Grant Webster / Food Stylist: Holly Dreesman / Prop Stylist: Gabe Greco', 'Bake in the preheated oven until a toothpick inserted into the center of a muffin comes out clean, about 30 minutes. Let cool slightly before serving.\n\n \n\n\n\n\n\n \n Grant Webster / Food Stylist: Holly Dreesman / Prop Stylist: Gabe Greco']","{'Calories': '135', 'Fat': '9g', 'Carbs': '3g', 'Protein': '10g'}",https://www.allrecipes.com/recipe/278443/easy-breakfast-egg-muffins/
Spinach and Bacon Quiche,"This spinach bacon quiche is the best-tasting quiche I have had in years. A friend of mine made this, and I just had to have the recipe. Great for brunch or for a light dinner with a cup of soup.",15 mins,45 mins,1 hr,8,"['¾ pound sliced bacon', '1 (9 inch) single refrigerated pie crust', '6 large eggs, beaten', '1 ½ cups heavy cream', '5 dashes hot pepper sauce, or to taste', '2 dashes Worcestershire sauce', 'salt and ground black pepper to taste', '1 (10 ounce) package frozen chopped spinach - thawed, drained and squeezed dry', '1 ½ cups shredded Cheddar cheese', '½ cup chopped green onion', '¼ cup grated Parmesan cheese']","['Preheat the oven to 375 degrees F (190 degrees C).', 'Place bacon in a large, deep skillet, and cook over medium-high heat, turning occasionally, until evenly browned, about 10 minutes. Drain bacon slices on a paper towel-lined plate. Chop when cool.', 'Fit pie crust into a 9-inch pie dish and set aside.', 'Whisk eggs, cream, hot pepper sauce, Worcestershire sauce, salt, and pepper together in a bowl.', 'Spread spinach over the bottom of pie crust. Top with bacon, Cheddar cheese, and green onion; pour in egg mixture and sprinkle with Parmesan cheese.', 'Bake quiche in the preheated oven until the top is lightly puffed and browned, and a knife inserted into the center of the quiche comes out clean, 35 to 45 minutes.']","{'Calories': '506', 'Fat': '42g', 'Carbs': '14g', 'Protein': '20g'}",https://www.allrecipes.com/recipe/216724/spinach-and-bacon-quiche/
Cape Malay Pickled Fish,"Pickled fish made with cod and a delicious pickling mixture made with red wine vinegar, brown sugar, chili pepper, garlic, and lots of spices. This dish is traditionally served with hot cross buns or freshly baked bread for Easter in Cape Town, South Africa.",30 mins,25 mins,1 day 1 hr 25 mins,12,"['½ cup vegetable oil for frying', '3 pounds cod fillets, cut into 2 to 3 ounce portions', 'salt to taste', '2 large onions, peeled and sliced into rings', '2 cloves garlic, chopped', '1  red chile pepper, seeded and sliced lengthwise', '3 large bay leaves', '8  whole black peppercorns', '4  whole allspice berries', '2 cups red wine vinegar', '½ cup water', '½ cup packed brown sugar, or to taste', '2 tablespoons curry powder', '2 teaspoons ground cumin', '2 teaspoons ground coriander', '1 teaspoon ground turmeric']","['Gather all ingredients.\n\n \n\n\n\n\n\n \n Dotdash Meredith Food Studios', 'Heat oil in a large skillet over medium-high heat. Season fish with salt and fry in the hot skillet until fish is browned and flakes easily with a fork, about 5 minutes per side. Transfer to a plate.\n\n \n\n\n\n\n\n \n Dotdash Meredith Food Studios', 'Add onions and garlic to the skillet and cook over medium heat until translucent, about 5 minutes. Add chile pepper, bay leaves, peppercorns, and allspice berries, then pour in vinegar and water and bring to a boil. Stir in brown sugar until dissolved. Season with curry powder, cumin, coriander, and turmeric. Taste and add brown sugar if desired.\n\n \n\n\n\n\n\n \n Dotdash Meredith Food Studios', 'Arrange layers of fish and pickling mixture in a serving dish. Pour in pickling liquid to cover the top layer. Let cool to room temperature, about 30 minutes. Cover and refrigerate for at least 24 hours before serving.\n\n \n\n\n\n\n\n \n Dotdash Meredith Food Studios']","{'Calories': '238', 'Fat': '10g', 'Carbs': '16g', 'Protein': '21g'}",https://www.allrecipes.com/recipe/104444/cape-malay-pickled-fish/
Baked Omelet,This omelet recipe is a little different as it's baked in the oven. It's a great breakfast or brunch for the holidays or any time you have company.,15 mins,40 mins,55 mins,4,"['8 large eggs', '1 cup milk', '½ cup shredded Cheddar cheese', '½ cup shredded mozzarella cheese', '3 ounces cooked ham, diced', '1 tablespoon dried minced onion', '½ teaspoon seasoning salt']","['Gather all ingredients. Preheat the oven to 350 degrees F (175 degrees C). Grease an 8-inch square baking dish.\n\n \n\n\n\n\n\n \n Dotdash Meredith Food Studios', 'Whisk eggs and milk together in a bowl.\n\n \n\n\n\n\n\n \n Dotdash Meredith Food Studios', 'Stir in Cheddar, mozzarella, ham, onion, and seasoning salt.\n\n \n\n\n\n\n\n \n Dotdash Meredith Food Studios', 'Pour into the prepared baking dish.\n\n \n\n\n\n\n\n \n Dotdash Meredith Food Studios', 'Bake, uncovered, in the preheated oven until set, 40 to 45 minutes.\n\n \n\n\n\n\n\n \n Dotdash Meredith Food Studios', 'Serve immediately and enjoy!\n\n \n\n\n\n\n\n \n Dotdash Meredith Food Studios']","{'Calories': '314', 'Fat': '21g', 'Carbs': '6g', 'Protein': '25g'}",https://www.allrecipes.com/recipe/15051/baked-omelet/
Mini Quiche Lorraine,"Try this individual quiche recipe for little quiche tarts that are perfect to serve at any party or shower. Or, keep them on hand for fast breakfasts during the week.",20 mins,35 mins,55 mins,12,"['24 (3 inch) frozen tart shells, thawed', '6 slices bacon, or more to taste', '1 ¼ cups shredded Swiss cheese, divided (Optional)', '2  green onions, diced', '1 ¼ cups milk', '4 large eggs', '1 teaspoon Dijon mustard', '¼ teaspoon salt', '¼ teaspoon ground black pepper']","['Preheat the oven to 375 degrees F (190 degrees C). Arrange tart shells in two 12-cup muffin tins; line each shell with a layer of pie weights or dried beans.', 'Bake in the preheated oven until crust edges are lightly browned and shells are about 3/4 fully cooked, 5 to 10 minutes. Remove from the oven and let sit until needed.', 'While the shells are baking, cook bacon in a large skillet over medium-high heat, turning occasionally, until browned and crispy, 7 to 10 minutes. Drain on paper towels and crumble when cooled.', 'Mix 1 cup Swiss, green onions, and crumbled bacon together in a bowl; divide mixture evenly among tart shells.', 'Whisk milk, eggs, mustard, salt, and pepper together in a bowl. Ladle egg mixture into each tart shell until about 2/3 full. Sprinkle remaining 1/4 cup Swiss over tarts.', 'Bake in the preheated oven until set in the middle and shells are golden brown, 25 to 30 minutes.\n\n \n\n\n\n\n\n \n Unknown']","{'Calories': '380', 'Fat': '20g', 'Carbs': '40g', 'Protein': '11g'}",https://www.allrecipes.com/recipe/229560/mini-quiche-lorraine/
Bacon on the Grill,Bacon on the grill is an easy alternative way to cook this favorite for a mess-free stove.,5 mins,15 mins,20 mins,6,['1 pound lean thick-cut bacon'],"['Preheat an outdoor grill for medium-low heat.', 'Line a large rimmed baking sheet with aluminum foil. Place a cooling rack on top. Place bacon on rack, making sure no pieces are overlapping.', 'Place baking sheet on the grill grate, close the lid, and cook for 12 minutes or until desired doneness. Transfer bacon to a paper towel-lined plate to absorb excess grease.']","{'Calories': '126', 'Fat': '11g', 'Protein': '7g'}",https://www.allrecipes.com/recipe/274001/bacon-on-the-grill/
Farmer's Casserole,"Layer the ingredients for this farmer's casserole in a baking dish the night before, then cover and refrigerate. In the morning, pop the casserole into the oven about an hour before serving. Serve with melon wedges, fresh strawberries, and orange wedges.",25 mins,40 mins,1 hr 10 mins,6,"['cooking spray', '3 cups frozen hash brown potatoes', '¾ cup shredded pepper Jack cheese', '1 cup cooked ham, diced', '¼ cup chopped green onions', '1 (12 fluid ounce) can evaporated milk', '4 large eggs, beaten', '¼ teaspoon ground black pepper', '⅛ teaspoon salt']","['Preheat the oven to 350 degrees F (175 degrees C).', 'Spray a 2-quart casserole dish with cooking spray.', 'Arrange hash brown potatoes evenly in the bottom of the prepared dish. Sprinkle with pepper Jack cheese, then ham, and finally green onions.', 'Whisk evaporated milk, eggs, pepper, and salt together in a medium bowl; pour over layers in the baking dish.', 'Bake in the preheated oven until a knife inserted in the center comes out clean, 40 to 45 minutes.', 'Remove from the oven and let rest for 5 minutes before serving.']","{'Calories': '316', 'Fat': '22g', 'Carbs': '21g', 'Protein': '18g'}",https://www.allrecipes.com/recipe/22454/farmers-casserole/
Spam and Eggs,"This Spam and eggs recipe is quick and easy. I'm on a diet that requires I eat over twice as much protein as carbohydrates, and this is hard since I Iove rice and biscuits! After days of eating tuna and eggs (not together), I came up with this recipe.",10 mins,5 mins,15 mins,2,"['2 large eggs, beaten', '1 (12 ounce) container fully cooked luncheon meat (e.g. Spam), cubed', '2 ounces Cheddar cheese, grated']","['Heat a nonstick skillet over medium heat. Pour eggs into the skillet, then scatter luncheon meat over top. Cook and stir until eggs are nearly set, 3 to 4 minutes. Sprinkle cheese over top and stir until cheese is melted, 1 to 2 minutes.']","{'Calories': '707', 'Fat': '60g', 'Carbs': '6g', 'Protein': '36g'}",https://www.allrecipes.com/recipe/39747/spam-and-eggs/
Breakfast Casserole,This delicious breakfast casserole with sausage and cream of mushroom soup is the perfect start to any morning.,20 mins,1 hr 40 mins,10 hrs,10,"['1 pound breakfast sausage', '6  eggs', '2 1/2 cups milk, divided', '¾ teaspoon dry mustard powder', '½ teaspoon salt', '8 slices bread, cubed', '4 cups shredded Cheddar cheese', '1 (10.5 ounce) can  condensed cream of mushroom soup']","['Grease a 9x13-inch baking dish.', 'Cook sausage in a large skillet over medium-high heat until evenly browned, crumbly, and no longer pink in the center, 7 to 9 minutes. Drain and discard any excess grease.', 'While the sausage is cooking, whisk eggs in a mixing bowl until smooth. Whisk in 2 cups milk, mustard powder, and salt until evenly blended.', 'Spread bread cubes into the prepared dish; sprinkle sausage over top, then Cheddar cheese. Pour egg mixture over the entire dish. Cover and refrigerate, 8 hours to overnight.', 'When ready to bake, preheat the oven to 300 degrees F (150 degrees C).', 'Remove casserole from the refrigerator and uncover. Whisk condensed soup and remaining 1/2 cup milk together in a bowl; pour mixture over casserole.', 'Bake in the preheated oven until firm and golden brown, about 1 1/2 hours.']","{'Calories': '451', 'Fat': '32g', 'Carbs': '16g', 'Protein': '25g'}",https://www.allrecipes.com/recipe/172671/breakfast-sausage-casserole/
