title,intro,prep_time,cook_time,total_time,servings,ingredients,directions,nutrition,recipe_url
Tuscan Salmon,"This Tuscan salmon takes you on a trip to central Italy, with this Tuscan-inspired main dish. Lots of flavors you love make a bed for some lovely pan-roasted salmon. Everything can be done in one skillet, and if you'd like a side of pasta, clean up will still be a breeze. We like this with risotto, a salad, and a good crusty bread, too!",10 mins,15 mins,25 mins,4,"['4 (5 ounce) salmon filets', 'salt and freshly ground black pepper to taste', '1 tablespoon olive oil', '1 tablespoon unsalted butter', '2 short rosemary sprigs, plus more for garnish', '1/3 cup chopped prosciutto', '1 green onion, finely chopped', '1 garlic clove, minced', '1 pinch red pepper flakes, or to taste', '1/2 lemon, zested', '1/2 cup dry white wine', '1 cup cherry tomato halves', '1 (10 ounce) package fresh spinach, torn', '1/2 cup heavy cream', '1 tablespoon olive oil for drizzling, or as needed', 'lemon slices', 'lightly toasted pine nuts (Optional)']","['Pat salmon filets dry with paper towels and season both sides with salt and pepper.', 'Melt butter in a large skillet over medium heat; add olive oil. When butter stops sizzling, swirl the skillet to combine. Add 2 or 3 rosemary sprigs to the skillet, to flavor the oil.', 'Add salmon and cook until salmon is lightly browned and flakes when a fork is gently inserted, about 3 minutes per side. (If salmon filets are thinner than 1 ½ inches, this may take less time.) An instant read thermometer, inserted near the center, should read 145 degrees F (63 degrees C). Remove from the skillet, and keep warm.', 'To the same skillet with rosemary, add chopped prosciutto, green onion, garlic, red pepper flakes, and lemon zest, and cook for 1 minute or until fragrant.', 'Add white wine and cook until the liquid evaporates. Add tomatoes and cook, stirring, 2 to 3 minutes. Add spinach and toss in the skillet until bright green and barely wilted, 2 to 3 minutes.', 'Stir in cream, and season with salt and pepper. Cook until sauce bubbles, about 2 minutes, and remove cooked rosemary sprigs.', 'Serve salmon on a bed of vegetables and sauce, and drizzle with a little olive oil. Garnish with lemon slices, fresh rosemary sprigs, and toasted pine nuts, if desired.']","{'Calories': '566', 'Fat': '40g', 'Carbs': '7g', 'Protein': '40g'}",https://www.allrecipes.com/tuscan-salmon-recipe-8673342
Salmon Caesar Salad,"This salmon Caesar salad, with Romaine lettuce, topped with cold salmon, toasted croutons, and a homemade Caesar dressing, will be the salad you will make all summer long.",25 mins,15 mins,2 hrs 40 mins,4,"['1 (8 ounce) salmon filet', '2 teaspoons oil', '2 teaspoons honey', 'salt and freshly ground black pepper to taste', '1 large egg', '2 tablespoons lemon juice', '2 teaspoons Worcestershire sauce', '1 1/2 teaspoons Dijon mustard', '2 cloves garlic, crushed', '3 anchovies', '1/4 cup freshly grated Parmesan cheese', 'freshly ground black pepper to taste', '1/2 cup olive oil', '1 tablespoon butter', '2 slices day-old bread, cut into cubes', '1/2 teaspoon italian seasoning', '1/4 teaspoon granulated garlic', '1 head Romaine lettuce, torn into bite-sized pieces', 'shaved Parmesan cheese for garnish']","['Set a nonstick skillet over medium high heat. Heat 2 teaspoons oil until it shimmers. Add salmon, skin side down. Brush with honey; sprinkle with salt and pepper. Cover and cook for 4 minutes.', 'Carefully flip salmon and reduce the heat to medium. Continue cooking until fish flakes easily with a fork, about 5 minutes more. Remove salmon to a plate or container; cover and refrigerate until very cold, at least 2 hours.', 'For dressing, crack an egg into a food processor. Add lemon juice, Worcestershire, Dijon, garlic, anchovies, grated Parmesan and black pepper; pulse to combine. With food processor running, drizzle in oil until mixture emulsifies. Refrigerate dressing until needed.', 'For croutons, melt butter in a heavy skillet over medium-high heat. Add bread cubes; sprinkle with Italian seasoning and granulated garlic.', 'Toast until croutons are browned, about 5 minutes. Remove from heat; set aside.', 'For salad, add lettuce to a large bowl. Flake salmon with a fork into bite-sized pieces and add to the bowl. Drizzle with Caesar dressing; top with croutons and shaved Parmesan.']","{'Calories': '544', 'Fat': '44g', 'Carbs': '19g', 'Protein': '21g'}",https://www.allrecipes.com/salmon-caesar-salad-recipe-8667191
Harissa Baked Salmon,This salmon dish with fiery harissa and smoky paprika has so much flavor and is ready in just 30 minutes. Be prepared to make this fantastic fish dish again and again!,15 mins,15 mins,30 mins,4,"['1 teaspoon vegetable oil', '1 pound wild salmon fillet', 'salt and pepper to taste', '4 thin slices lemon', '2 thin slices sweet onion, separated into rings', '⅓ cup mayonnaise', '1 teaspoon lemon juice', '1 teaspoon harissa', '¼ teaspoon smoked paprika', '1 tablespoon orange juice', '1 tablespoon white wine']","['Preheat the oven to 425 degrees F (220 degrees C). Coat the inside of a 9x12-inch baking dish with vegetable oil.', 'Place salmon fillet into the baking dish; sprinkle with salt and pepper. Arrange lemon slices and onion rings on the salmon.', 'Mix mayonnaise, lemon juice, harissa, and smoked paprika together in a bowl until well combined; spread on top of salmon, lemon, and onion slices. Drizzle orange juice and wine around salmon.', 'Bake in the preheated oven until salmon is hot and has begun to turn opaque, 10 to 12 minutes. Remove the baking dish from the oven, set a broiler rack about 5 inches from the broiler, and turn the broiler on. Broil the fish until nicely browned, about 3 minutes.\n\n \n\n\n\n\n\n \n France Cevallos']","{'Calories': '380', 'Fat': '29g', 'Carbs': '2g', 'Protein': '25g'}",https://www.allrecipes.com/harissa-baked-salmon-recipe-8645607
Grilled Tuna Steaks with Wasabi-Blueberry Sauce,"For these grilled tuna steaks with wasabi-blueberry sauce, wasabi and soy sauce add heat and umami to a fresh-cooked blueberry sauce drizzled over tuna. When cooking fish to rare or medium-rare, always use sushi-grade to reduce risk of foodborne illness.",10 mins,15 mins,1 hr,4,"['1 tablespoon vegetable oil', '1 shallot, minced', '1 (6 ounce) package fresh blueberries', '1 tablespoon honey', '1 tablespoon less-sodium soy sauce', '1 teaspoon rice vinegar', '1 teaspoon wasabi paste', '1 1/2 pounds 1-inch-thick sushi-grade tuna steaks', '1/4 teaspoon salt', '1/4 teaspoon freshly ground black pepper', '1 tablespoon furikake seasoning, or more as needed', 'hot cooked rice, for serving', 'chopped fresh cilantro, for garnish']","['For sauce, heat oil in a small saucepan over medium heat. Add shallot; cook, stirring occasionally, until softened, 3 to 5 minutes. Add blueberries, honey, soy sauce, and vinegar. Bring to a boil; reduce heat and simmer, uncovered, until most of blueberries have burst, about 5 minutes. Transfer to a medium bowl. Set bowl in a larger bowl filled with ice water. Let cool completely, about 20 minutes. Stir in wasabi paste.', 'Preheat grill to medium-high heat (375 to 400 degrees F (190 to 200 degrees C)). Pat tuna steaks dry with paper towels. Season with salt and pepper. Spread furikake seasoning on a small plate. Roll edges of tuna steaks in furikake to coat.', ""Oil grill grates. Grill tuna, covered, turning halfway through, about 4 minutes. (Tuna should be pink in center.) Transfer tuna to a cutting board; tent with foil and let stand 5 minutes. Thinly slice tuna steaks and serve over rice with sauce. Garnish with cilantro.\n\n Cook's Notes:\nLessen Sodium: Omit or reduce soy sauce. Instead of rolling tuna steaks in furikake, reduce amount to 1/2 teaspoon and sprinkle over sliced tuna as a garnish.Boost Protein: Round out this meal with protein-packed steamed edamame.Shrink the Sweet Stuff: Reduce honey by 1 teaspoon to cut added sugars by two-thirds.""]","{'Calories': '321', 'Fat': '5g', 'Carbs': '16g', 'Protein': '51g'}",https://www.allrecipes.com/grilled-tuna-steaks-with-wasabi-blueberry-sauce-recipe-8658669
Ultimate Lowcountry Shrimp and Grits,"This recipe for the ultimate Lowcountry shrimp and grits is modeled after my mother-in-law’s recipe, for which she won first place in Charleston, SC. It features grits with fresh white sweet corn, topped with a rich tomato gravy and deep fried shrimp, then finished with crumbled bacon.",30 mins,1 hr 10 mins,1 hr 40 mins,6 to 8,"['4 cups water', '1 cup milk or half-and-half', '3 tablespoons butter', '1 1/2 teaspoons kosher salt', '1 1/4 cups stone ground grits', '2 ears white sweet corn', '1/4 teaspoon freshly ground black pepper', '1 1/2 teaspoons olive oil', '6 slices bacon', '1 onion, diced', '4 green onions, divided', '1/2 green bell pepper, diced', '1/2 red bell pepper, diced', '4 ounces okra, thinly sliced', '1 teaspoon kosher salt', '1/2 teaspoon freshly ground black pepper', '1/2 teaspoon garlic powder', '1/4 teaspoon cayenne pepper', '2 cloves garlic', '2 ripe tomatoes, seeded and diced', '1 1/2 tablespoons butter', '2 tablespoons all-purpose flour', '1 (10 ounce) can diced tomatoes with green chiles', '2 cups chicken stock', '1/2 teaspoon white sugar', '2 teaspoons Worcestershire sauce', '1/2 teaspoon hot sauce, or to taste (optional)', '2 cups peanut oil or other vegetable oil for frying', '3 large eggs', '1 1/2 pounds medium shrimp,\xa0peeled and deveined', '2 cups all-purpose flour', '2 teaspoons kosher salt', '1 1/2 teaspoons paprika', '1 teaspoon freshly ground black pepper', '1/2 teaspoon cayenne pepper', '3 green onions, thinly sliced', 'chopped parsley for garnish (optional)']","['Combine water, milk, butter, and salt in a large saucepan and bring just to a boil. Whisk in grits until incorporated. Reduce heat to simmer, cover, and cook until thick, 25 to 30 minutes, stirring often. If mixture gets too thick, add a little more milk or water.', 'Cut kernels off corn cobs, and using the back of the knife, carefully scrape the cob to release the creamy corn milk. Stir corn kernels and corn milk into grits and continue cooking until grits are creamy and tender, 15 to 20 minutes longer, stirring often. Stir in pepper and adjust seasonings if necessary.', 'Meanwhile, heat a large deep skillet or Dutch oven over medium heat. Add olive oil and bacon slices in a single layer, and cook until bacon is crisp, stirring occasionally, about 7 minutes.\xa0 Remove bacon from the skillet, drain on paper towels, and set aside. Crumble bacon once cool enough to handle. Reserve drippings in the skillet and return skillet to medium-high heat.', 'Finely slice green onions and reserve green ends for garnish. Add white parts of green onion, onion, green and red bell peppers, and okra to the skillet and cook until softened and lightly browned, stirring often, about 5 minutes. Add in salt, pepper, garlic powder, and cayenne and cook for 1 minute. Add fresh tomatoes and garlic, and cook for 2 minutes.', 'Add butter to mixture and allow it to melt. Sprinkle flour over skillet and cook, stirring constantly, about 1 minute. Add in tomatoes, with juices, and stock while stirring constantly until smooth. Stir in sugar, Worcestershire, and hot sauce, and return mixture to a simmer. Cook gravy for 10 minutes, stirring occasionally.', 'Heat peanut oil to 350 degrees F (175 degrees C) in a large, deep skillet over medium-high heat. Whisk eggs in a bowl; add shrimp and stir to coat. In a shallow dish, whisk flour, salt, paprika, black pepper, and cayenne pepper.', 'Working a few at a time, remove shrimp from egg, allowing excess to drip off, and lightly coat in flour mixture. Transfer shrimp to a wire rack set inside a rimmed baking sheet. Repeat with remaining shrimp.', 'Working in batches, add shrimp to hot oil and cook, turning occasionally, until lightly browned and crisp, 1 to 2 minutes. Drain on a wire rack set over a paper towel-lined baking sheet.', 'To serve, place grits in the bottom of a shallow bowl. Top with about 1/2 cup of gravy and 6 to 8 shrimp. Top with crumbled bacon, and sprinkle with green onions and parsley if desired.\n\n \n\n\n\n\n\n \n Dotdash Meredith Food Studios\n\n From the Editor:\nNutrition data for this recipe includes the full amount of breading ingredients. The actual amount of breading consumed will vary. We have determined the nutritional value of oil for frying based on a retention value of 10% after cooking. The exact amount will vary depending on cooking time and temperature, ingredient density, and specific type of oil used.']","{'Calories': '695', 'Fat': '28g', 'Carbs': '66g', 'Protein': '45g'}",https://www.allrecipes.com/ultimate-lowcountry-shrimp-and-grits-recipe-8660975
Individual Salmon Wellingtons,"These individual salmon Wellingtons are salmon filets, topped with herbs, Dijon mustard, feta, and spinach, and encased in golden-brown puff pastry. Elegant without a lot of fuss, the salmon is moist and perfectly cooked inside crisp-tender flaky pastry bundles.",20 mins,25 mins,45 mins,4 (serving size: one puff pastry wrapped salmon fillet),"['1/2 teaspoon kosher salt', '1/2 teaspoon ground black pepper', '4 (6-ounce) skinless salmon fillets', '1/2 cup mayonnaise', '1/4 cup Dijon mustard', '2 teaspoons chopped\xa0fresh oregano', '2 teaspoons chopped fresh basil', '2 teaspoons chopped\xa0fresh dill\xa0weed', '2 teaspoons lemon zest', '1 teaspoon chopped\xa0fresh thyme', '1/2 cup crumbled\xa0feta cheese', '1/2 (10-ounce) package frozen chopped spinach, thawed and drained', '1 frozen puff pastry sheet, thawed', '1 egg', '1 tablespoon water', 'Lemon wedges']","['Gather all ingredients. Preheat oven to 400 degrees F (200 degrees C). Line a baking sheet with parchment paper; set aside.\n\n \n\n\n\n\n\n \n Dotdash Meredith Food Studios', 'Pat salmon fillets dry with paper towels. Sprinkle salt and pepper on both sides of the salmon.\n\n \n\n\n\n\n\n \n Dotdash Meredith Food Studios', 'Mix mayonnaise, mustard, oregano, basil, dill, lemon zest, and oregano in a small bowl. Set aside half the mixture for serving.\n\n \n\n\n\n\n\n \n Dotdash Meredith Food Studios', 'Spread remaining mixture on the top of salmon fillets.\n\n \n\n\n\n\n\n \n Dotdash Meredith Food Studios', 'Sprinkle feta cheese on top of the salmon. Top with spinach.\n\n \n\n\n\n\n\n \n Dotdash Meredith Food Studios', 'Cut the pastry sheet in quarters. Roll each portion on a lightly floured surface to a 7x7-inch square.\n\n \n\n\n\n\n\n \n Dotdash Meredith Food Studios', 'Place each salmon fillet, topping side down, in the center of a pastry portion.\n\n \n\n\n\n\n\n \n Dotdash Meredith Food Studios', 'Lift edges of pastry to enclose the salmon. Pinch edges to seal, and place each bundle, seam-side down, on prepared baking sheet.\n\n \n\n\n\n\n\n \n Dotdash Meredith Food Studios', 'Beat together egg and water in small bowl. Brush egg wash on tops and sides of pastry bundles. Cut several small slits in tops of each pastry bundle to allow steam to escape.\n\n \n\n\n\n\n\n \n Dotdash Meredith Food Studios', 'Bake in preheated oven until pastry is golden brown, 20 to 25 minutes. Serve with reserved herb Dijon mixture and lemon wedges.\n\n \n\n\n\n\n\n \n Dotdash Meredith Food Studios']","{'Calories': '715', 'Fat': '51g', 'Carbs': '23g', 'Protein': '46g'}",https://www.allrecipes.com/individual-salmon-wellingtons-recipe-8417008
Tuscan Butter Shrimp,"These Tuscan butter shrimp, in a delightful cherry tomato and sun-dried tomato cream sauce, can be served over pasta or polenta, or with a salad and toasted sourdough bread.",15 mins,15 mins,30 mins,4,"['1 pound peeled, deveined large raw shrimp, patted dry', '1 teaspoon kosher salt', '1/2 teaspoon freshly ground black pepper', '2 tablespoons unsalted butter, divided', '2 tablespoons oil from jar of oil-packed sun-dried tomatoes, divided', '1 1/2 cups cherry tomatoes, halved', '1/2 cup thinly sliced shallot', '3 garlic cloves, thinly sliced', '1/2 cup drained and finely chopped sun-dried tomatoes in oil', '1 cup packed fresh baby spinach', '1/2 cup  loosely packed fresh basil leaves, sliced, plus more for garnish', '1/2 cup dry white wine', '1 teaspoon grated lemon zest', '1/4 teaspoon crushed red pepper', '1 cup heavy cream', '2 ounces Parmesan cheese, grated, plus more for garnish', '1 teaspoon fresh lemon juice']","['Gather all ingredients.\n\n \n\n\n\n\n\n \n Dotdash Meredith Food Studios', 'Toss shrimp with salt and pepper in a large bowl until well combined. Heat a large high-sided skillet over medium heat. Add 1 tablespoon butter and 1 tablespoon sun-dried tomato oil; heat until shimmering, about 2 minutes. Add shrimp in an even layer, and cook until opaque and pink, 3 to 4 minutes, flipping shrimp halfway through cooking time. Transfer shrimp to a large plate.\n\n \n\n\n\n\n\n \n Dotdash Meredith Food Studios', 'Melt remaining 1 tablespoon butter with remaining 1 tablespoon sun-dried tomato oil in the same skillet; stir in cherry tomatoes, shallot, garlic, and sun-dried tomatoes. Cook, stirring occasionally, until tomatoes are soft and shallot is translucent, about 4 minutes.\n\n \n\n\n\n\n\n \n Dotdash Meredith Food Studios', 'Stir spinach, basil, wine, lemon zest, and crushed red pepper into mixture in skillet; cook over medium, scraping up any browned bits from bottom of skillet, until wine mixture is reduced by half, about 2 minutes. Stir in heavy cream. Reduce heat to low, and add Parmesan cheese; cook, stirring constantly, until mixture is slightly thickened and simmering, about 2 minutes. Remove from heat.\n\n \n\n\n\n\n\n \n Dotdash Meredith Food Studios', 'Stir in lemon juice; add cooked shrimp along with any juices from plate. Garnish with additional basil and Parmesan cheese.\n\n \n\n\n\n\n\n \n Dotdash Meredith Food Studios']","{'Calories': '540', 'Fat': '41g', 'Carbs': '16g', 'Protein': '23g'}",https://www.allrecipes.com/tuscan-butter-shrimp-recipe-8654858
Creamy Lemon Shrimp Pasta,"This lovely lemon garlic shrimp dish with spaghetti pasta is deliciously creamy and comes together in just 30 minutes, making it perfect for busy weeknights!",10 mins,20 mins,30 mins,6,"['¾ (16 ounce) package spaghetti', '1 pound uncooked medium shrimp, peeled and deveined', 'salt and ground black pepper to taste', '2 tablespoons finely chopped shallots', '1 tablespoon crushed garlic', '¼ cup chicken broth', '1 medium lemon, zested and juiced', '½ cup heavy cream', '5 large basil leaves, chopped', '1 pinch red pepper flakes']","['Bring a large pot of lightly salted water to a boil. Cook spaghetti in the boiling water, stirring occasionally, until tender yet firm to the bite, about 10 to 12 minutes.', 'While the pasta is cooking, heat oil in a large skillet over medium heat. Season shrimp with salt and pepper; add to the pan and cook 30 seconds per side. Remove to a plate.', 'Add shallots to the skillet and cook for 2 minutes. Add garlic and cook until fragrant, about 1 minute. Stir in chicken broth, lemon zest, and 1/2 of the lemon juice; heat for 2 minutes. Reserve remaining lemon juice for another use.', 'Add cream and bring to a simmer. Return shrimp to the skillet and cook until heated through and pink, 2 to 3 minutes. Add basil.', 'Drain spaghetti, reserving 1/4 to 1/2 cup pasta water.', 'Add spaghetti to the skillet. Add pasta water as needed and pepper flakes; toss to coat. Season with pepper if desired.']","{'Calories': '248', 'Fat': '9g', 'Carbs': '20g', 'Protein': '21g'}",https://www.allrecipes.com/creamy-lemon-shrimp-pasta-recipe-8642461
Marry Me Shrimp Pasta,This creamy shrimp dish will make any pasta lover swoon.,10 mins,20 mins,30 mins,8,"['12 ounces \xa0uncooked calamarata or rigatoni\xa0pasta', '2 tablespoons oil from sun-dried tomato jar', '1 pound jumbo peeled and deveined tail-on\xa0raw shrimp', '1/3 cup coarsely chopped sun-dried tomatoes in oil', '1 ½ tablespoons sun-dried tomato\xa0spread', '5 large garlic cloves, grated', '1 ½ tablespoons all-purpose flour', '3/4 cup dry\xa0white wine', '1 ½ cups chicken broth', '3/4 cup heavy cream', '3/4 cup\xa0freshly grated Parmesan cheese', '1 ½ teaspoons dried\xa0Italian seasoning', '3/4 teaspoon smoked paprika', 'chopped fresh basil (Optional)']","['Gather all ingredients. Cook pasta in salted water according to package directions; drain and set aside.\n\n \n\n\n\n\n\n \n Dotdash Meredith Food Studios', 'Meanwhile, heat 2 tablespoons sun-dried tomato oil in a large skillet over medium-high heat. Add shrimp and cook until pink on both sides and just cooked through, turning once, about 2 minutes per side; transfer to a separate bowl and set aside.\n\n \n\n\n\n\n\n \n Dotdash Meredith Food Studios', 'Add sun-dried tomatoes, tomato spread, and garlic to the same skillet; cook, stirring constantly, until fragrant, about 1 minute. Stir in flour and continue cooking, stirring constantly, 1 minute.\n\n \n\n\n\n\n\n \n Dotdash Meredith Food Studios', 'Whisk in wine, scraping up any browned bits from bottom of pan. Bring to a simmer and cook, undisturbed, until slightly reduced, about 2 minutes.\n\n \n\n\n\n\n\n \n Dotdash Meredith Food Studios', 'Add broth, heavy cream, parmesan cheese, Italian seasoning, and smoked paprika; whisk until fully combined. Reduce heat to medium and continue cooking, whisking occasionally, until slightly thickened and just coats the back of a spoon, 5 to 7 minutes.\n\n \n\n\n\n\n\n \n Dotdash Meredith Food Studios', 'Reduce heat to low; add cooked pasta and shrimp to skillet. Cook, stirring often, until evenly coated and heated through, about 3 minutes.\n\n \n\n\n\n\n\n \n Dotdash Meredith Food Studios', 'Remove from heat; garnish with basil and serve immediately.\n\n \n\n\n\n\n\n \n Dotdash Meredith Food Studios']","{'Calories': '300', 'Fat': '16g', 'Carbs': '20g', 'Protein': '15g'}",https://www.allrecipes.com/marry-me-shrimp-pasta-recipe-8637241
Grilled Shrimp Caesar Wraps,"These grilled shrimp Caesar wraps are filled with juicy grilled shrimp, seasoned with smoked paprika and garlic, and wrapped in a tortilla with crisp Romaine lettuce, Caesar dressing, and crouton pieces. It's a delightful mix of flavors and textures in every bite.",20 mins,10 mins,45 mins,4,"['1 pound raw shrimp', '2 tablespoons olive oil', '1 teaspoon granulated garlic', '1 teaspoon smoked paprika', '1/4 tsp salt and freshly ground black pepper', '4 (10 inch) low-carb flour tortillas', '2 cups chopped Romaine lettuce', '1 cup croutons, coarsely chopped', '1/2 cup creamy Caesar yogurt dressing, such as Bolthouse Farms®']","['Combine shrimp, olive oil, smoked paprika, granulated garlic, salt, and pepper in a large bowl. Toss to coat; let marinate for 15 minutes.', 'Preheat an outdoor grill or grill pan for high heat. Thread shrimp onto skewers if using an outdoor grill. Grill shrimp until they are bright pink on the outside and the meat is opaque, 2 to 3 minutes per side; remove to a plate. Warm tortillas on the grill for about 10 to 15 seconds per side.', 'Chop shrimp into 1/2-inch pieces and place into a large bowl. Add lettuce, croutons, and Caesar dressing. Divide mixture down the center of each tortilla. Fold in the sides of the tortillas and then roll up tightly from the bottom. Cut wraps in half diagonally and serve.']","{'Calories': '883', 'Fat': '32g', 'Carbs': '112g', 'Protein': '36g'}",https://www.allrecipes.com/grilled-shrimp-caesar-wraps-recipe-8643516
One-Pan Shrimp And Rice,Juicy lemony shrimp nestled in fluffy herby and cheesy jasmine rice is a great weeknight dinner option that's light yet filling—and all cooked in one-pan.,5 mins,25 mins,30 mins,4,"['5 tablespoons unsalted butter, divided', '1 yellow onion, finely chopped', '6 cloves garlic, finely chopped', '1/4 cup dry white wine', '2 cups chicken stock', '2 teaspoons lemon zest', '1 1/2 teaspoons kosher salt', '1/4 teaspoon freshly ground black pepper', '1 1/2 cups uncooked jasmine rice, rinsed', '1 pound medium peeled, deveined raw shrimp', '1 tablespoon freshly squeezed lemon juice', '1/2 cup freshly grated Parmesan cheese', '2 tablespoons finely chopped fresh basil, plus small leaves for garnish', 'lemon wedges for serving']","['Gather all ingredients.\n\n \n\n\n\n\n\n \n Dotdash Meredith Food Studios', 'Melt 1 tablespoon butter in a large nonstick skillet over medium. Add onion, and cook, stirring occasionally, until soft and translucent, about 3 minutes. Add garlic, and cook, stirring constantly, until garlic is fragrant and onions are lightly browned, about 1 minute. Stir in wine, and cook, stirring occasionally, until wine is reduced by half, about 3 minutes.\n\n \n\n\n\n\n\n \n Dotdash Meredith Food Studios', 'Stir in chicken stock, lemon zest, salt, and black pepper. Bring to a boil over medium, and stir in rice. Cover and reduce heat to low. Simmer, undisturbed, until rice is just cooked through, 9 to 10 minutes. Add shrimp to rice in an even layer; drizzle with lemon juice, and dot with remaining 4 tablespoons butter. Cover and continue to cook over medium until shrimp and rice are cooked through, 5 to 6 minutes.\n\n \n\n\n\n\n\n \n Dotdash Meredith Food Studios', 'Remove from heat. Stir in Parmesan cheese and basil. Garnish with lemon wedges and basil leaves.\n\n \n\n\n\n\n\n \n Dotdash Meredith Food Studios']","{'Calories': '482', 'Fat': '21g', 'Carbs': '49g', 'Protein': '27g'}",https://www.allrecipes.com/one-pan-shrimp-and-rice-recipe-8635722
