title,intro,prep_time,cook_time,total_time,servings,ingredients,directions,nutrition,recipe_url
The Best Easy Shrimp Enchiladas,"I'm calling these the best easy shrimp enchiladas, and they are, without a doubt, the best shrimp enchiladas you will ever taste, thanks to my secret ingredient, canned lobster bisque. They are rich, meaty, and delicious, have a deeper flavor than most lighter shrimp enchiladas, and you don't have to make the creamy enchilada sauce from scratch.",30 mins,35 mins,1 hr 15 mins,8,"['32 extra-large raw shrimp (16 to 20 per pound), peeled and deveined', '½ teaspoon salt, or more as needed', '1 pinch cayenne pepper', '2 tablespoons avocado oil, plus more as needed', '1 cup diced poblano pepper or other green chili pepper', '1 cup diced onion', '2 tablespoons chili powder', '2 teaspoons smoked paprika', '1 teaspoon ground cumin', '½ teaspoon freshly ground black pepper', '¼ teaspoon ground chipotle pepper', '3 cloves garlic, minced', '½ cup water', '2  (15-ounce) cans lobster bisque soup', '2 tablespoons tomato paste (optional)', '2 rounded tablespoons chopped cilantro', '8 (6-inch) flour tortillas', '6 ounces Monterey Jack cheese, shredded', '6 ounces Cheddar cheese, shredded', '1 jalapeño, thinly sliced, or more to taste', '2 radishes, thinly sliced, or more to taste', '½ cup sour cream, or as needed', 'hot sauce, as needed', '1 lime, cut into wedges for serving']","['Preheat the oven to 450 degrees F (230 degrees C). Season shrimp with salt and cayenne in a bowl and toss with tongs to evenly coat.', 'Add 1 tablespoon of avocado oil to a skillet, and set on medium-high heat. Place shrimp, without crowding, in a single layer in the skillet; sear for 30 to 60 seconds per side, then transfer to a bowl. You will have to work in batches. Place seared shrimp in the refrigerator.', 'Add peppers, onions, and a large pinch of salt to the skillet. Reduce heat to medium, and cook, stirring up the brown bits from the bottom of the pan, until onions begin to turn translucent, 3 to 5 minutes.', 'Season with chili powder, smoked paprika, cumin, black pepper, chipotle pepper, and garlic; sauté for 1 to 2 minutes more. Remove 8 rounded tablespoons of the mixture to a bowl and set aside.', 'Pour water into the pan and stir to deglaze the bottom. Stir in lobster bisque, plus a few tablespoons of water used to rinse the cans. Add tomato paste and raise heat to medium-high; stir until well combined. Bring sauce to a simmer, reduce heat to medium, and simmer for 5 to 10 minutes, stirring occasionally.', 'Meanwhile, remove shrimp from the refrigerator, and pour any accumulated juices from the shrimp into the sauce. Turn off heat, stir in cilantro, and season with salt and black pepper to taste.', 'Transfer half the sauce into the bottom of a large (15x10-inch) baking dish.', 'Brush each tortilla on both sides with avocado oil. Toss Monterey Jack and Cheddar cheese together in a bowl.', 'Top each tortilla with 1/4 cup cheese mixture, followed by 4 shrimp. Top with 1 spoon of reserved veggie mixture. Add 2 tablespoons cheese mixture on top and roll up tortilla, finishing with seam on bottom.', 'Place 8 rolled enchiladas into the baking dish, seam on bottom, and top with remaining sauce. Sprinkle over remaining cheese, or more if desired.', 'Bake in the preheated oven until the top starts to brown, and the sauce is bubbly, 20 to 25 minutes. Let enchiladas rest for about 10 minutes before serving. While resting, garnish with thinly sliced jalapeños and radishes.', 'Serve with extra sauce from the bottom of the dish spooned over. Garnish with additional sliced jalapeño, radish, and chopped cilantro, and serve with sour cream, hot sauce, and fresh lime wedges.\n\n \n\n\n\n\n\n \n Chef John']","{'Calories': '518', 'Fat': '28g', 'Carbs': '39g', 'Protein': '26g'}",https://www.allrecipes.com/the-best-easy-shrimp-enchiladas-recipe-8398887
Sheet Pan Steak and Shrimp Fajitas,"Love the ease of a sheet pan? Your next dinner should be these sheet pan steak and shrimp fajitas. Slice up the vegetables and give them a slight head start in the oven, so everything will be cooked at the same time. Serve with Mexican rice or lime-cilantro rice.",15 mins,20 mins,35 mins,4,"['2 teaspoons chili powder', '1 teaspoon smoked paprika', '1 teaspoon Mexican oregano', '1 teaspoon salt, or to taste', '1/2 teaspoon ground cumin', '1/2 teaspoon garlic powder', '1/4 teaspoon cayenne pepper, or to taste', '1 green bell pepper, thinly sliced', '1 red bell pepper, thinly sliced', '1 onion, thinly sliced', '3 tablespoons olive oil, divided', '1 pound sirloin steak, sliced 1/4-inch thick across the grain', '16 medium shrimp, peeled and deveined', '1 lime, halved', '1/2 cup fresh cilantro sprigs', '8 (8-inch) flour tortillas']","['Preheat the oven to 425 degrees F (220 degrees C). Line 2 sheet pans with parchment paper or aluminum foil.', 'Combine chili powder, smoked paprika, oregano, salt, cumin, garlic powder, and cayenne in a small bowl.', 'In a large bowl, combine green bell pepper, red bell pepper, and onion with 1 1/2 tablespoons olive oil and 1/2 of dry seasoning mixture. Toss until evenly coated with seasoning mixture and spread out in a single layer on one of the prepared pans.', 'Meanwhile, in the same large bowl, toss steak and shrimp with remaining 1 1/2 tablespoons olive oil; add remaining seasoning and toss again. Place steak on one side of second prepared pan, with shrimp on the other side of pan.', 'Place steak and shrimp on a rack below vegetables and roast both pans for 10 minutes. After 10 minutes, swap rack positions of the pans, bringing the lower pan up, and placing the other pan on the rack below. Continue roasting until shrimp is pink and tightly curled, steak is cooked to medium, and vegetables are tender, about 5 minutes more. An instant read thermometer inserted in center of steak should read 140 degrees F (60 degrees C) . If steak or vegetables require more time, remove shrimp to a plate and keep warm, while other ingredients continue cooking. Squeeze juice of half a lime over contents of each sheet pan.', 'To serve: Place a few steak strips, onion and pepper strips, 2 shrimp, and some cilantro on each tortilla. Roll up tortillas and contents jelly-roll fashion, and enjoy!\n\n Cook’s Note\nTwo pans are used in this recipe to avoid crowding food in the pans, allowing food to roast rather than steam.We like these fajitas with avocado slices, cheese, sour cream, and cilantro, but you may add any toppings you and your family like!']","{'Calories': '1074', 'Fat': '41g', 'Carbs': '121g', 'Protein': '54g'}",https://www.allrecipes.com/sheet-pan-steak-and-shrimp-fajitas-recipe-8305215
Shrimp Marinara,Shrimp marinara hits all the right spots - tasty shrimp with homemade tomato sauce served over spaghetti. A quick and easy weeknight meal.,10 mins,15 mins,25 mins,4,"['12 ounces dry spaghetti', '3 tablespoons extra virgin olive oil', '1 pound large shrimp, peeled and deveined', '4 cloves garlic, sliced', '1/2 teaspoon crushed red pepper', '1 (15-ounce) can diced fire-roasted tomatoes', '1 (15 ounce) can tomato sauce', '1/4 cup chopped fresh basil, plus more for garnish', '1 tablespoon balsamic vinegar', '1 teaspoon dried oregano', '1/4 teaspoon kosher salt']","['Gather all ingredients.\n\n \n\n\n\n\n\n \n Dotdash Meredith Food Studios', 'Prepare spaghetti according to package directions; drain and keep warm.\n\n \n\n\n\n\n\n \n Dotdash Meredith Food Studios', 'Meanwhile, heat oil over medium heat in a large skillet. Add shrimp and cook 2 to 3 minutes or until nearly opaque, turning once.\n\n \n\n\n\n\n\n \n Dotdash Meredith Food Studios', 'Transfer shrimp to a plate. Add garlic and crushed red pepper to the skillet. Cook and stir until fragrant, about 1 minute.\n\n \n\n\n\n\n\n \n Dotdash Meredith Food Studios', 'Stir in undrained tomatoes, tomato sauce, basil, balsamic vinegar, oregano, and salt. Bring to a boil. Reduce heat and simmer, uncovered, until thickened, 10 minutes.\n\n \n\n\n\n\n\n \n Dotdash Meredith Food Studios', 'Return shrimp to skillet and simmer to heat through, about 1 minute. Serve over spaghetti, topped with additional fresh basil.\n\n \n\n\n\n\n\n \n Dotdash Meredith Food Studios']","{'Calories': '595', 'Fat': '14g', 'Carbs': '77g', 'Protein': '39g'}",https://www.allrecipes.com/shrimp-marinara-recipe-7972426
Cornmeal-Crusted Cod,Crispy cornmeal-crusted cod takes a quick dip in lime juice for extra flavor before pan frying. Is there really anything better than fried fish?,15 mins,5 mins,20 mins,5,"['12 cod filets', '1/4 cup lime juice', '2/3 cup cornmeal', '2/3 cup all-purpose flour', 'salt and freshly ground black pepper to taste', '1/2 cup olive oil', '1/4 cup butter']","['Rinse cod filets with water. Pat fish dry.', 'Place lime juice in a shallow bowl. Whisk cornmeal, flour, salt, and pepper together in a separate shallow bowl.', 'Heat oil and butter in a large cast-iron skillet over medium heat. Using tongs, dip cod into lime juice; allow excess to drip off. Press fish into cornmeal mixture to coat on all sides; set aside on a plate.', 'Fry cod in the hot skillet until crispy golden brown, 2 to 3 minutes. Turn and fry until fish flakes easily with a fork and is golden brown on the other side; about 1 minute more. Cooking time will depend on thickness of filets. You may have to fry in batches.', 'Remove fish to a wire rack set over a drip tray to catch any excess oil. Serve immediately.\n\n From the Editor:\nNutrition data for this recipe includes the full amount of breading ingredients. The actual amount of breading consumed will vary. We have determined the nutritional value of oil for frying based on a retention value of 10% after cooking. The exact amount will vary depending on cooking time and temperature, ingredient density, and specific type of oil used.']","{'Calories': '605', 'Fat': '8g', 'Carbs': '26g', 'Protein': '102g'}",https://www.allrecipes.com/cornmeal-crusted-cod-recipe-7973525
Seasoned Pan-Fried Cod,This simple dry rub seasoned pan-fried cod comes together in flash and tastes like it is straight off the grill.,5 mins,5 mins,10 mins,2,"['1 teaspoon smoked paprika', '1/2 teaspoon kosher salt', '1/4 teaspoon garlic powder', '1/4 teaspoon onion powder', '1/8 teaspoon celery seed', '2 (6 ounce) cod filets, patted dry', '1 tablespoon unsalted butter', '1 tablespoon lemon juice', '2 teaspoons chopped parsley (optional)']","['Add smoked paprika, salt, garlic powder, onion powder, and celery seed to a bowl; stir until evenly combined. Season cod filets on all sides with mixture and place on a plate.', 'Melt butter in a skillet over medium-high heat. Add cod and fry for 3 minutes.', 'Turn filets over, add lemon juice, and fry until cod flakes easily with a fork, about 2 minutes more. Transfer to a serving plate; garnish with parsley.']","{'Calories': '237', 'Fat': '7g', 'Carbs': '2g', 'Protein': '39g'}",https://www.allrecipes.com/seasoned-pan-fried-cod-recipe-7972712
Bourbon Teriyaki Salmon Rice Bowl,"For these bourbon teriyaki salmon rice bowls, salmon is coated with mustard and everything bagel seasoning, and baked with broccoli on a sheet pan. A simple homemade bourbon teriyaki sauce adds next-level flavor.",15 mins,16 mins,31 mins,2,"['2 (6 ounce) salmon filets', '4 teaspoons Dijon mustard', '1 tablespoon everything bagel seasoning', '1 head broccoli, chopped into small pieces', '3 tablespoons olive oil', '1 teaspoon onion powder', '1/3 cup bourbon whiskey', '1/3 cup low-sodium soy sauce', '1/4 cup brown sugar', '1 small clove garlic, chopped', '1 tablespoon chopped fresh ginger', '2 cups cooked white rice']","['Preheat the oven to 400 degrees F (200 degrees C) and spray a baking pan with cooking spray.', 'Place salmon filets skin side down on the prepared baking pan; brush with Dijon mustard and sprinkle with everything bagel seasoning.', 'Toss broccoli, olive oil, and onion powder together in a bowl; spread broccoli on the baking pan.', 'Bake in the preheated oven until the salmon flakes easily with a fork, about 15 minutes.', 'Combine bourbon, soy sauce, brown sugar, garlic, and ginger in a small saucepan over medium heat. Cook until brown sugar is dissolved, and sauce begins to bubble, 1 to 3 minutes.', 'Divide rice into 2 serving bowls. To each bowl, add half the broccoli and 1 salmon filet. Pour bourbon teriyaki sauce over each bowl.']","{'Calories': '996', 'Fat': '43g', 'Carbs': '86g', 'Protein': '51g'}",https://www.allrecipes.com/bourbon-teriyaki-salmon-rice-bowl-recipe-7968978
Creamy Cajun Shrimp and Sausage Pasta,"This creamy Cajun shrimp and sausage pasta dish was inspired by the flavors of gumbo. Like lots of gumbos, this recipe starts with a roux that adds depth and complexity to the creamy sauce. We like this with a simple green salad and crusty bread.",20 mins,25 mins,45 mins,6,"['1/4 cup unsalted butter', '1/4 cup all purpose flour', '1 medium onion, chopped', '1 cup chopped celery', '2/3 cup chopped red bell pepper', '2/3 cup chopped green bell pepper', '2 clove garlic, minced', '2 teaspoons Cajun seasoning', '1/2 cup chicken broth', '1/2 pound thinly sliced, fully cooked smoked sausage', '1/4 teaspoon crushed red pepper flakes', '1/2 teaspoon freshly ground black pepper', ""salt to taste (see Cook's Notes)"", ""1/2 pound raw shrimp, peeled and deveined (see Cook's Notes)"", '1/2 cup heavy whipping cream', '12 ounces spaghetti, cooked', 'chopped fresh parsley for garnish (optional)', 'lemon slices for garnish (optional)']","['Melt butter in a large, heavy saucepan over medium heat until foamy, about 2 minutes. Stir in flour to foamy butter, whisking quickly to make sure there are no lumps. Continue stirring until roux turns a dark, reddish brown, about 5 minutes.', 'Stir in onion, celery, bell peppers, and garlic. Cook and stir until the vegetables have begun to be tender, about 5 minutes.', 'Stir in Cajun seasoning and chicken broth and bring to a boil. Add sliced smoked sausage and season with red pepper flakes, black pepper, and salt to taste. Cover, reduce heat to low, and simmer about 10 minutes.', 'Remove cover, increase heat to medium high, and return to a boil. Add shrimp and cream, and cookuntil shrimp turn pink and are curled into a C-shape, about 3 minutes.', 'Serve warm over cooked spaghetti. Garnish with fresh parsley and lemon slices, if desired.']","{'Calories': '408', 'Fat': '27g', 'Carbs': '28g', 'Protein': '15g'}",https://www.allrecipes.com/creamy-cajun-shrimp-and-sausage-pasta-recipe-7963501
Cajun Shrimp and Sausage Pasta Bake,This Cajun shrimp and sausage pasta bake is fast to assemble featuring andouille sausage and shrimp in a creamy Cajun Alfredo sauce.,15 mins,45 mins,1 hr,4,"['10 ounces penne pasta', '1 tablespoon butter', '1/2 onion, chopped', '1/2 red bell pepper, chopped', '8 ounces shrimp, peeled and deveined', '8 ounces andouille sausage, quartered', '1 tablespoon butter', '1 tablespoon flour', '2 cloves garlic, minced', '1 tablespoon Cajun seasoning', '1/2 cup 2% milk', '1/2 cup half and half', '1/2 cup reserved pasta water', '4 ounces garlic and herb spreadable cheese, such as alouette® garlic and herbs soft spreadable cheese, cut into chunks', '1 cup freshly grated Parmesan cheese']","['Preheat the oven to 375 degrees F (190 degrees C). Grease a 9x13-inch casserole dish. Bring a pot of lightly salted water to a boil.', 'Meanwhile, melt 1 tablespoon butter in a heavy skillet. Add onion and bell pepper, and cook until softened, 3 to 5 minutes. Stir in sausage and shrimp. Turn off heat; the residual heat will cook the shrimp and warm the sausage. Remove skillet from heat after a few minutes.', 'Stir penne into boiling water and return to a boil. Cook pasta uncovered, stirring occasionally, for 6 minutes.', 'Using a slotted spoon, transfer about half of pasta to the skillet. Transfer remaining pasta to prepared casserole. Reserve 1/2 cup pasta water.', 'In a saucepan, melt 1 tablespoon butter over medium heat and whisk in flour. Add garlic and Cajun seasoning. Whisking constantly, slowly pour in milk, half and half, and reserved pasta water until sauce is smooth and bubbly, 2 to 3 minutes. Stir in alouette cheese and Parmesan cheese and allow it to melt, 1 to 2 minutes more.', 'Pour half of sauce over pasta in the casserole. Transfer sausage mixture to the casserole, and use a spoon to gently blend all ingredients. Pour remaining sauce over pasta mixture. Cover casserole with foil.', 'Bake in the preheated oven until heated through and bubbly, about 25 minutes. Serve immediately.']","{'Calories': '635', 'Fat': '39g', 'Carbs': '35g', 'Protein': '35g'}",https://www.allrecipes.com/cajun-shrimp-and-sausage-pasta-bake-recipe-7644847
Homemade Fish Sticks,"These baked homemade fish sticks served with tartar sauce come out crispy on the outside and tender on the inside. You can use cod, halibut, or catfish fillets.",20 mins,20 mins,40 mins,4,"['1 pound cod, halibut, or catfish filets, thawed if frozen', '1/2 teaspoon salt', '1/4 teaspoon freshly ground black pepper', '1 cup panko bread crumbs', '2 teaspoons Old Bay seasoning', '1 large egg', '1 tablespoon water', '1/3 cup flour', 'cooking spray', '1 lemon, cut into wedges', '1/3 cup mayonnaise', '2 tablespoons pickle relish (sweet or dill)', '1 tablespoon finely chopped red onion', '1 1/2 teaspoons chopped fresh dill', '1 teaspoons capers (optional)', '1/2 teaspoon freshly squeezed lemon juice']","['Gather all ingredients.\n\n \n\n\n\n\n\n \n Dotdash Meredith Food Studios', 'Preheat the oven to 375 degrees F (190 degrees C). Line a baking sheet with parchment paper or use a silicone baking mat.', 'Blot fish dry with paper towels. Season fish with salt and pepper. Cut filets crosswise in 1-inch strips.\n\n \n\n\n\n\n\n \n Dotdash Meredith Food Studios', 'Combine panko and Old Bay seasoning in a shallow dish. Beat together egg and water in a second shallow dish. Place flour in a third shallow dish.', 'Dip fish pieces in flour to coat, shaking off excess, then in egg mixture, then in panko. Place breaded fish sticks on the prepared baking sheet.\n\n \n\n\n\n\n\n \n Dotdash Meredith Food Studios', 'Coat fish sticks generously with cooking spray. Bake freshly breaded or frozen fish sticks until golden brown, 18 to 20 minutes, turning once halfway through baking time.\n\n \n\n\n\n\n\n \n Dotdash Meredith Food Studios', 'For Tartar Sauce, in a small bowl whisk together mayonnaise, pickle relish, onion, dill weed, capers (if using), and lemon juice. Chill at least 2 hours before serving and up to 1 week.\n\n \n\n\n\n\n\n \n Dotdash Meredith Food Studios', 'Serve fish sticks with Tartar Sauce and lemon wedges.\n\n \n\n\n\n\n\n \n Dotdash Meredith Food Studios']","{'Calories': '486', 'Fat': '18g', 'Carbs': '51g', 'Protein': '35g'}",https://www.allrecipes.com/homemade-fish-sticks-recipe-7555292
Salmon Couscous Salad,"This salmon couscous salad recipe features salmon, couscous, and arugula salad layered in a bowl and drizzled with homemade pesto dressing for a unique presentation. This dish is a nod to a dish I tried at a local restaurant.",20 mins,10 mins,30 mins,2,"['1/2 cup mayonnaise', '1/2 cup buttermilk', '1/4 cup prepared pesto', '1 lemon, juiced', '1 clove garlic', 'ground black pepper to taste', '1 (5.8 ounce) package herb and garlic couscous', '1/2 pound salmon filet, with skin', '1 teaspoon Greek seasoning, such as Cavender’s® Greek Seasoning', '1 teaspoon butter', '1 teaspoon olive oil', '2 Roma tomatoes, seeded and chopped', '2 cups arugula and spinach salad mix, roughly chopped', '2 tablespoons shredded Parmesan cheese', '2 tablespoons pepitas']","['Add mayonnaise, buttermilk, pesto, lemon juice, and garlic to the bowl of a food processor. Blend until smooth. Season to taste with black pepper. Set dressing aside.', 'Meanwhile, heat a skillet over medium-high heat. Season salmon with Greek seasoning. Cut salmon into two filets. Melt butter in a skillet over medium heat and add olive oil. Place salmon, skin side down, in the hot skillet. Cook until salmon flakes easily with a fork, about 8 minutes.', 'Bring water to a boil in a saucepan; remove from heat and stir couscous into the water. Cover saucepan and let stand until water is absorbed completely, about 10 minutes.', ""To assemble, place salad mixture into 2 dinner bowls, and sprinkle chopped tomatoes over the salad. Fluff couscous with a fork. Mound couscous in the center of each bowl. Sprinkle Parmesan cheese around couscous. Place a salmon filet to the side of the couscous. Pour 1 to 2 tablespoons pesto dressing on top of dish. Sprinkle with pepitas. Serve immediately.\n\n  Cook's Note:  \n Nutrition data for this recipe includes the full amount of dressing ingredients. The actual amount of dressing consumed will vary.""]","{'Calories': '983', 'Fat': '77g', 'Carbs': '34g', 'Protein': '39g'}",https://www.allrecipes.com/salmon-couscous-salad-recipe-7561932
Curry-Coconut Shrimp,Jumbo shrimp in a light coconut curry sauce. It's easy to adjust the amount of spices and curry powder to suit your taste. Add more coconut milk if you prefer a saucier curry. Serve over your favorite rice.,10 mins,25 mins,35 mins,4,"['1 teaspoon canola oil', '½ cup minced onion', '½ cup minced red bell pepper', '1 clove garlic, minced', '1 teaspoon ground cumin', '¾ teaspoon ground coriander', '½ teaspoon curry powder, or to taste', '½ cup light coconut milk', '1 teaspoon sugar', '¼ teaspoon crushed red pepper flakes', '1 pound jumbo shrimp, peeled and deveined', '1 tablespoon cornstarch', '1 tablespoon water', '2 tablespoons chopped fresh cilantro']","['Heat oil in large, nonstick saucepan over medium heat. Sauté onion, red pepper, and garlic until vegetables begin to soften, about 3 minutes.', 'Season with cumin, coriander, and curry powder. Cook for 1 more minute. Stir in coconut milk, sugar, and crushed red pepper flakes. Bring to a boil. Reduce heat, and simmer, uncovered for 2 minutes.', 'Stir in shrimp, and increase heat to medium-high. Cook and stir until shrimp is cooked through, about 4 minutes.', 'Combine cornstarch with 1 tablespoon water in a small bowl; stir into shrimp mixture and cook until sauce has thickened, about 1 minute. Stir in cilantro, and remove from heat.']","{'Calories': '191', 'Fat': '6g', 'Carbs': '9g', 'Protein': '24g'}",https://www.allrecipes.com/recipe/50836/curry-coconut-shrimp/
Air Fryer Shrimp Fried Rice,"This fried rice is so deliciously savory, nobody will believe you made it with an air fryer. It's full of toasted, crunchy rice bits that add a great contrast to the chewy interior. The shrimp is tender and juicy, and the bites of peas burst in your mouth. Finish it up with Sriracha mayo and fresh green onion to compliment everything perfectly. If you don't have shrimp on hand, you can also use leftover chicken or steak.",15 mins,30 mins,45 mins,4,"['1 tablespoon canola oil', '1/3 cup chopped onion', '1/3 cup chopped carrot', '1 teaspoon kosher salt, divided', '2 large eggs, lightly beaten', '1 pound large, peeled, deveined raw shrimp', '2 (8-ounce) packages pre-cooked microwavable brown rice', '3/4 cup frozen green peas', '1 tablespoon soy sauce', '1 teaspoon rice vinegar', '1/4 teaspoon freshly ground black pepper', '1 tablespoon toasted sesame seeds, or as needed (optional)', '1/4 cup Sriracha mayonnaise, or as needed', '1 scallion, sliced, or as needed']","['Remove the basket insert from air fryer. Preheat the air fryer to 400 degrees F (200 degrees C) for 5 minutes.', 'Add oil to the basket holder to coat; add onion, carrot, and 1/2 teaspoon of the salt, and stir to combine. Cook for 5 minutes. Add eggs; cook until partially set, about 3 minutes.', 'Add shrimp, rice, peas, soy sauce, vinegar, pepper, and remaining salt to egg mixture; stir to combine. Cook for 10 minutes. Stir mixture, sprinkle with sesame seeds, if desired, and cook until heated throughout and crisp, 10 to 15 minutes more. Drizzle with Sriracha mayonnaise, and sprinkle with scallions.']","{'Calories': '402', 'Fat': '17g', 'Carbs': '37g', 'Protein': '24g'}",https://www.allrecipes.com/air-fryer-shrimp-fried-rice-recipe-7555952
Baked Whole Crappie,"These baked crappies are scored before baking, making it so simple to eat each little section of the fish. The tails are left on for presentation and the freshness of cilantro and garlic adds wonderful flavors without overpowering the fish.",25 mins,20 mins,45 mins,4,"['4 whole crappie fish, gutted and cleaned, tails still on', '1 bunch fresh cilantro', '1/4 cup extra virgin olive oil', '2 tablespoons lime juice', '3 cloves garlic', '2 teaspoons salt', '1 teaspoon paprika', '8 thin lemon slices']","['Preheat the oven to 400 degrees F (200 degrees C). Line a shallow baking pan with aluminum foil.', 'Pat fish dry; score the skin of fish in a diamond pattern with a very sharp knife. Place fish on the prepared baking pan. Cover tails of fish with aluminum foil to avoid overbrowning.', 'Combine cilantro, olive oil, lime juice, garlic, salt, and paprika in a blender; pulse until mixture is a soft paste.', 'Spread cilantro-garlic paste on each fish, pressing the paste into the scored sections.\xa0 Place 2 lemon slices on each fish.', 'Bake, uncovered, in the preheated oven until fish flakes easily when tested with a fork, about 20 minutes.']","{'Calories': '338', 'Fat': '24g', 'Carbs': '3g', 'Protein': '27g'}",https://www.allrecipes.com/baked-whole-crappie-recipe-7505219
